player_id,player_name,sportsdata_id,player_team_id,player_position_id,player_positions,player_short_name,player_eligibility,player_yahoo_positions,player_page_url,player_filename,player_square_image_url,player_image_url,player_yahoo_id,cbs_player_id,player_bye_week,player_owned_avg,player_owned_espn,player_owned_yahoo,player_opponent,player_opponent_id,player_ecr_delta,rank_ecr,rank_min,rank_max,rank_ave,rank_std,note,tag,recommendation,pos_rank,start_sit_grade,r2p_pts,uncertainty
15514,Derrick Henry,87c481c7-7414-43cc-82df-19ca0c2ae22e,TEN,RB,RB,D. Henry,RB,RB,https://www.fantasypros.com/nfl/players/derrick-henry.php,derrick-henry.php,https://images.fantasypros.com/images/players/nfl/15514/headshot/210x210.png,https://images.fantasypros.com/images/players/nfl/15514/headshot/210x210.png,29279,2061188,13,100.0,99.9,100,vs. KC,KC,,1,1,1,1.00,0.00,"The guess here is that younger fantasy managers have a greater appreciation of Henry than older fantasy managers. The grizzled fantasy veterans who were playing in the early 2000s experienced something similar with Marshall Faulk, Priest Holmes, and LaDainian Tomlinson, giants of the era who routinely produced mammoth seasons and carried fantasy teams to championships almost singlehandedly. But there have been few saviors at the RB position in the generation since, so perhaps the young'uns are more in awe of Henry's greatness than the graybeards are. At the moment, the point differential between Henry and the RB2 in half-point PPR fantasy scoring is greater than the pint differential between the RB2 (Austin Ekeler) and the RB16 (Antonio Gibson). This week, Henry should feast on a Chiefs defense that ranks 31st in DVOA against the run and is giving up 5.2 yards per carry.",,,RB1,A+,22.6,0.0
16421,Alvin Kamara,d9c857b2-97da-4fb8-a527-afbbb2a67413,NO,RB,RB,A. Kamara,RB,RB,https://www.fantasypros.com/nfl/players/alvin-kamara.php,alvin-kamara.php,https://images.fantasypros.com/images/players/nfl/16421/headshot/210x210.png,https://images.fantasypros.com/images/players/nfl/16421/headshot/210x210.png,30180,2082721,6,100.0,99.9,100,at SEA,SEA,,2,2,3,2.04,0.19,"It's certainly been an interesting year for Kamara. He's had games where he's been used similarly to Derrick Henry with a massive workload on the ground and then other games we've seen the usage from him that we've become familiar with in previous seasons. Either way, we know that he's going to be given plenty of work each and every week and that's all we should care about as fantasy managers. With his skill set and talent, he has the ability to translate that volume into top-5 fantasy production every single week. In a matchup against the Seahawks defense that's allowing the fourth-most fantasy points to opposing RBs this year, AK's a top-tier option.",,,RB2,A+,21.2,0.01805
16673,Aaron Jones,27dd5b6e-ea65-4622-a6b4-460fd144407c,GB,RB,RB,A. Jones,RB,RB,https://www.fantasypros.com/nfl/players/aaron-jones.php,aaron-jones.php,https://images.fantasypros.com/images/players/nfl/16673/headshot/210x210.png,https://images.fantasypros.com/images/players/nfl/16673/headshot/210x210.png,30295,2071937,13,99.9,99.8,100,vs. WAS,WAS,,3,2,7,3.56,1.10,"Jones' usage has been fairly predictable this season not counting a Week 1 blowout loss to the Saints where the Packers held the ball infrequently and sent starters to the bench early. Since Week 2, Jones has had 13-17 carries and 2-6 catches every week. He's the RB6 in fantasy scoring and the RB5 if you take away Week 1. That dependable usage and a favorable home matchup with Washington make him a high-end RB1. He's also a core cash-game pillar at a price of $7,500 on DraftKings. The Packers have ramped up Dillon's usage in recent weeks. He's played at least 33% of the Packers' offensive snaps in each of the last three weeks, averaging 11.3 carries over that span. Against a mediocre Washington run defense that's yielding 21.7 fantasy points per game to opposing RBs, Dillon checks in as a playable midrange RB3 in a bye-strewn week.",,,RB3,A,18.4,0.6050000000000001
18588,Darrell Henderson Jr.,380c4d9b-d4c8-456c-ba50-25519edde899,LAR,RB,RB,D. Henderson Jr.,RB,RB,https://www.fantasypros.com/nfl/players/darrell-henderson.php,darrell-henderson.php,https://images.fantasypros.com/images/players/nfl/18588/headshot/210x210.png,https://images.fantasypros.com/images/players/nfl/18588/headshot/210x210.png,31902,2240590,11,98.8,98.6,99,vs. DET,DET,,4,3,6,3.89,0.79,"There are only six other RBs in the NFL right now that are averaging more fantasy points per game than Henderson. While that's extremely impressive on a surface level, it's even more impressive when you take into account that Henderson has done that against rock-solid defenses like Chicago, Indianapolis, and Arizona. He's faced some easier matchups the past couple of weeks against Seattle and the Giants and we're seeing what that means for fantasy purposes as he's delivered some big performances. Looking forward, Henderson now gets to take on the Lions defense that is allowing the most fantasy points to opposing RBs so far this season with an average of 25.2 points per game. Additionally, he gets to take on the Houston Texans defense in week eight and then the Tennessee Titans defense in week nine. The schedule has dramatically opened up for the talented RB and there's a very good chance that he wins people championships this year with how well he's playing. He belongs in your lineup this week as a top-5 option.",,,RB4,A,17.7,0.20803333333333338
19217,Jonathan Taylor,925195a4-06ba-4e37-ae7d-a3d6a5419139,IND,RB,RB,J. Taylor,RB,RB,https://www.fantasypros.com/nfl/players/jonathan-taylor.php,jonathan-taylor.php,https://images.fantasypros.com/images/players/nfl/19217/headshot/210x210.png,https://images.fantasypros.com/images/players/nfl/19217/headshot/210x210.png,32711,2866395,14,99.8,99.6,100,at SF,SF,,5,4,9,5.59,1.39,"It wasn't looking good for Taylor from a fantasy perspective through the first half of last week, but the Colts remembered that they had him on their roster in the second half and he went ballistic. Taylor rumbled for 145 yards on the ground and two touchdowns and he helped carry the Colts to a dominant win over the Texans. JT reminded us that he's a truly special RB when he is given the smallest sliver of daylight as one of his touchdowns was the result of a 83-yard run in which he hit 20.5 MPH according to Next Gen Stats. He'll have a more difficult time breaking free for long runs here against the 49ers defense that's allowing just 77 rushing yards per game to opposing RBs, but that doesn't mean that we should move Taylor out of our top-5 RBs on the week. Fire him up with full confidence here.",,,RB5,A,16.6,0.4830249999999999
19210,D'Andre Swift,cc4b5f58-a11c-4450-a1df-617ad88336e4,DET,RB,RB,D. Swift,RB,RB,https://www.fantasypros.com/nfl/players/dandre-swift.php,dandre-swift.php,https://images.fantasypros.com/images/players/nfl/19210/headshot/210x210.png,https://images.fantasypros.com/images/players/nfl/19210/headshot/210x210.png,32705,2871710,9,98.7,98.4,99,at LAR,LAR,,6,5,9,5.96,1.20,"Through six weeks of the 2021 NFL season, Swift is second in the NFL at the RB position in targets with 42. His usage on the ground leaves a lot to be desired, but he continues to come through for fantasy managers due to his workload through the air as the Lions play from behind. Due to the fact that Detroit has yet to play a single offensive snap this season with a lead, it's likely that Swift's high target volume is here to stay. Up to this point of the season, Swift is averaging seven targets per contest and nearly 50 receiving yards. That volume more than makes up for his lack of production on the ground and it's especially valuable in any type of PPR format. This week against the Rams, we shouldn't expect much from Swift on the ground, but we know that the Lions are going to be playing from behind for the majority of the game. We could see Swift potentially push 10 targets in this one and he's a rock-solid RB1 start because of it.",,,RB6,A,16.1,0.288
16378,Leonard Fournette,7f46a7be-286e-4bfe-8778-d03dbe600ce9,TB,RB,RB,L. Fournette,RB,RB,https://www.fantasypros.com/nfl/players/leonard-fournette.php,leonard-fournette.php,https://images.fantasypros.com/images/players/nfl/16378/headshot/210x210.png,https://images.fantasypros.com/images/players/nfl/16378/headshot/210x210.png,30117,2131693,9,96.7,96.3,97,vs. CHI,CHI,,7,4,11,7.81,1.89,"It's difficult to argue with the fact that Fournette is now the lead back for the Bucs, one of the best offenses in the league. He's dominated the snap count and opportunity share in this backfield over the past few weeks and he's rising up rest-of-season rankings as a result. Looking ahead to week seven, Fournette belongs in starting lineups simply due to the lack of other proven options at the position due to bye weeks, injuries, etc. but he might not as much upside as we would hope for in this matchup against the Bears. Chicago has kept opposing RBs somewhat in check so far this season and they're only allowing 15.7 fantasy points per game to opposing RBs. Fournette should see enough volume to be a reliable high-end RB2 this week, but he'll need to cash in and find the end zone to crack the top-8 at the position.",,,RB7,A,15.7,0.893025
11613,Cordarrelle Patterson,da85107c-365c-4d58-90ab-479d97d798b4,ATL,RB,RB,C. Patterson,"WR,RB","WR,RB",https://www.fantasypros.com/nfl/players/cordarrelle-patterson.php,cordarrelle-patterson.php,https://images.fantasypros.com/images/players/nfl/11613/headshot/210x210.png,https://images.fantasypros.com/images/players/nfl/11613/headshot/210x210.png,26652,1996183,6,93.6,95.1,92,at MIA,MIA,,8,6,12,8.89,1.57,"Patterson played a season-high 46 snaps in the Falcons' Week 5 win over the Jets in London - 20 more than his previous high this season. Is that a sign that the Falcons are all in on Paterson as a major driver of their offense? Perhaps they should be. Patterson has been terrific as a pass-catcher, lining up all over the formation - in the backfield, in the slot, out wide - and catching 25 of 31 targets for 295 yards and four touchdowns. He's also been solid as a runner, with 41 carries for 173 yards and a touchdown. He's currently the RB3 in fantasy scoring on a per-game basis, and while it's probably unrealistic to expect that pace to continue, C-Patt is an automatic start in all season-long leagues. He checks in as the RB7 in this week's rankings (and as the WR14 if your league only grants him WR eligibility).",,,RB8,A-,15.7,0.41081666666666666
16420,Joe Mixon,7797f36e-87e8-4282-b6d2-bdb1774fc3b3,CIN,RB,RB,J. Mixon,RB,RB,https://www.fantasypros.com/nfl/players/joe-mixon.php,joe-mixon.php,https://images.fantasypros.com/images/players/nfl/16420/headshot/210x210.png,https://images.fantasypros.com/images/players/nfl/16420/headshot/210x210.png,30161,2131143,10,99.7,99.4,100,at BAL,BAL,,9,6,13,9.11,2.11,"Backups Samaje Perine and Chris Evans have chimed in with notable performances in recent weeks, but Mixon is still the straw that stirs the drink in the Bengals' backfield. He's averaging 18 carries a game and ranks fourth in the league in rushing with 480 yards. The Ravens have been a middling fantasy matchup for opposing running backs this season, but they've had Mixon's number throughout his career. In seven career games against Baltimore, Mixon is averaging 55.1 yards per game and 3.2 yards per carry, and he's scored only one TD.",,,RB9,A-,15.2,0.7420166666666667
17514,Darrel Williams,c2a19a09-74a2-4ace-8cc3-6dfb65070a70,KC,RB,RB,D. Williams,RB,RB,https://www.fantasypros.com/nfl/players/darrel-williams.php,darrel-williams.php,https://images.fantasypros.com/images/players/nfl/17514/headshot/210x210.png,https://images.fantasypros.com/images/players/nfl/17514/headshot/210x210.png,31500,2131714,12,86.7,84.4,89,at TEN,TEN,,10,6,11,9.15,1.46,"With Clyde Edwards-Helaire sidelined with a sprained MCL, Williams took over as the lead RB and paid off for his fantasy stakeholders, with 21-62-2 rushing and 3-27-0 receiving, good for an RB6 finish on the week. Williams served as a true workhorse, playing 59 snaps - 10 more than Edwards-Helaire had played in any game this season. With CEH out again, Williams is a must-start against a middle-of-the-road Tennessee run defense. He ranks RB8 this week and is an excellent DraftKings value at $5,800.",,,RB10,A-,14.9,0.3552666666666666
19792,Chuba Hubbard,32205e74-b23f-420a-b312-465b29260745,CAR,RB,RB,C. Hubbard,RB,RB,https://www.fantasypros.com/nfl/players/chuba-hubbard.php,chuba-hubbard.php,https://images.fantasypros.com/images/players/nfl/19792/headshot/210x210.png,https://images.fantasypros.com/images/players/nfl/19792/headshot/210x210.png,33514,2865693,13,91.6,92.2,91,at NYG,NYG,,11,6,12,9.26,1.51,"In the three games Christian McCaffrey has missed so far, Hubbard's fantasy finishes in half-point PPR scoring have been RB36, RB18 and RB21. Not great, but the usage over that three-game span is encouraging: 17.7 carries per game and 3.7 targets per game. That sort of workload could pay off this week against a Giants defense that gave up 24.2 fantasy points to Ezekiel Elliott in Week 5 and 23.7 to Darrell Henderson in Week 6. He's a low-end RB1 this week and a good DraftKings value at $6,100.",,,RB11,A-,14.1,0.38001666666666667
22813,Elijah Mitchell,8ba68abf-e9d2-4927-bf8d-476f271d840c,SF,RB,RB,E. Mitchell,RB,RB,https://www.fantasypros.com/nfl/players/elijah-mitchell-rb.php,elijah-mitchell-rb.php,https://images.fantasypros.com/images/players/nfl/22813/headshot/210x210.png,https://images.fantasypros.com/images/players/nfl/22813/headshot/210x210.png,33582,2819876,6,76.0,75.9,76,vs. IND,IND,,12,12,19,13.04,1.50,"Before the bye week, we saw Mitchell come back into the lineup and completely dominate the RB touches in this backfield. While it didn't lead to much volume, that was with Lance in the lineup and dominating the carry share. With Jimmy G at QB this week - most likely - we should see the 49ers lean into their run game again with Mitchell and he could easily see 15+ touches in this game. The matchup isn't ideal as the Colts are allowing the second-fewest fantasy points to opposing RBs, but the volume should be there. He can be viewed as a mid-range RB2 this week.",,,RB12,B+,13.6,0.1875
18269,Josh Jacobs,61694ab9-b099-408e-b48d-6a643dd069ec,LV,RB,RB,J. Jacobs,RB,RB,https://www.fantasypros.com/nfl/players/josh-jacobs.php,josh-jacobs.php,https://images.fantasypros.com/images/players/nfl/18269/headshot/210x210.png,https://images.fantasypros.com/images/players/nfl/18269/headshot/210x210.png,31856,2257876,8,97.1,97.1,97,vs. PHI,PHI,,13,11,16,13.22,1.26,"Jacobs has continued with his struggles last season with efficiency - he has just a 3.2 Yards Per Attempt on the season - but he's continued to find the end zone at an impressive rate. Jacobs is now tied for the third-most rushing TDs in the NFL despite having only played four games this year. He's bringing a safe floor with his guaranteed volume each week and then is also bringing plenty of upside with his propensity for crossing over the goal line. In a matchup against the Eagles defense that is allowing the 7th-most fantasy points to opposing RBs, Jacobs should be viewed as a rock-solid low-end RB1/high-end RB2.",,,RB13,B+,12.8,0.14432727272727275
17496,Chase Edmonds,d8d9b161-7ef4-42bf-89b7-7edf806a0ad1,ARI,RB,RB,C. Edmonds,RB,RB,https://www.fantasypros.com/nfl/players/chase-edmonds.php,chase-edmonds.php,https://images.fantasypros.com/images/players/nfl/17496/headshot/210x210.png,https://images.fantasypros.com/images/players/nfl/17496/headshot/210x210.png,31104,2137507,12,93.9,93.8,94,vs. HOU,HOU,,14,11,21,15.74,3.30,"Edmonds has a fantastic matchup on paper, but this actually might be more to his detriment than benefit. With the projected game script that Arizona is going to be able to run the ball for the entire second half with a big lead, Edmonds probably isn't going to be needed all that much. Especially if he's still dealing with his shoulder injury, we could see the Cardinals rest him in a game that they'll be able to win practically with their eyes closed. Edmonds receives more value in tighter game scripts where he's needed more as a receiving outlet out of the backfield, but that's simply not the case here. He can be viewed as still a solid start due to the other available options at the RB position, but there's not a ton of upside here when you take a closer look.",,,RB14,B+,12.6,0.9899999999999999
13943,Mike Davis,e311a7a2-eddb-439c-86b4-b1f1984186bc,ATL,RB,RB,M. Davis,RB,RB,https://www.fantasypros.com/nfl/players/mike-davis-rb.php,mike-davis-rb.php,https://images.fantasypros.com/images/players/nfl/13943/headshot/210x210.png,https://images.fantasypros.com/images/players/nfl/13943/headshot/210x210.png,28514,2000079,6,89.8,86.5,93,at MIA,MIA,,15,14,21,16.00,2.28,"Davis is a solid play against a Miami run defense allowing 26.5 fantasy points per game to opposing running backs, tied for the league-high with the Chargers. He's a high-end RB2. Patterson is $6,300 on DraftKings, Davis is $5,200, and I find both to be strong values. If forced to pick just one, I'm continuing to ride the C-Patt Express.",,,RB15,B,12.5,0.37131428571428565
18230,Damien Harris,59482736-ce42-4058-b68e-0f9f66eac2d9,NE,RB,RB,D. Harris,RB,RB,https://www.fantasypros.com/nfl/players/damien-harris-rb.php,damien-harris-rb.php,https://images.fantasypros.com/images/players/nfl/18230/headshot/210x210.png,https://images.fantasypros.com/images/players/nfl/18230/headshot/210x210.png,31919,2186318,14,90.1,85.2,95,vs. NYJ,NYJ,,16,13,19,16.44,1.23,"At the time of writing, there's no clarity as to whether or not Harris is going to even suit up for this game. He's been battling a rib injury over the past couple of weeks, but he has been able to fight through it up to this point. Even with this injury, Harris remains a special player. There are some runs that he has where he looks like he's shot out of a cannon and he's clearly the best RB that the Patriots have on their roster. If Harris suits up in this matchup, he's absolutely worth playing as a potential high-end RB2 simply based on the other available options this week. The Jets are allowing the second most fantasy points to opposing RBs this season and Harris has already found the end zone once against them this year. There's a high likelihood that he can do it again in this one if he's healthy. We'll continue to update as we get more injury news.",,,RB16,B,12.3,0.11637692307692307
16447,James Conner,28a084c0-14df-499f-bd1f-b975603626b7,ARI,RB,RB,J. Conner,RB,RB,https://www.fantasypros.com/nfl/players/james-conner.php,james-conner.php,https://images.fantasypros.com/images/players/nfl/16447/headshot/210x210.png,https://images.fantasypros.com/images/players/nfl/16447/headshot/210x210.png,30218,2071585,12,87.8,84.5,91,vs. HOU,HOU,,17,15,20,16.78,1.26,"Are there any leagues where you have Conner on your roster that you're contemplating not starting him this week? Everything is lining up here for Conner to have a monstrous performance. The Cardinals are 17.5-point favorites at the time of writing, Chase Edmonds doesn't appear to be at 100%, and the Cardinals are most likely going to be running the ball for the entire second half. We should see Conner get plenty of work this week against an abysmal defense that is bleeding fantasy points to opposing RBs and he's going to get goal-line opportunities. Normally, we don't want to rely on Conner over more proven options in our starting lineup, but with so many RBs currently on byes and injured, Conner should be viewed as a mid-range RB2 this week.",,,RB17,B,12.0,0.10584
18283,Miles Sanders,ef3ceaf4-b733-4e06-a7f4-a94fc67361c1,PHI,RB,RB,M. Sanders,RB,RB,https://www.fantasypros.com/nfl/players/miles-sanders.php,miles-sanders.php,https://images.fantasypros.com/images/players/nfl/18283/headshot/210x210.png,https://images.fantasypros.com/images/players/nfl/18283/headshot/210x210.png,31885,2251305,14,94.8,94.5,95,at LV,LV,,18,14,23,18.04,2.60,"Through six games this season, this is what Sanders is currently averaging per game from a usage standpoint: 9.5 carries, 45 rushing yards, zero touchdowns, three receptions, 20.16 receiving yards, and zero receiving touchdowns. He is now the RB38 on the season from a Fantasy Points Per Game perspective and is behind players like Myles Gaskin, Mike Davis, and JD McKissic to just name a few. There is absolutely no upside with Sanders whatsoever this season and it's never a guarantee that he's going to walk out of any game with more than five carries, but he absolutely belongs in starting lineups this week due to the barren RB landscape. The Raiders are allowing over 100 rushing yards per contest so far this season, so there's the possibility that Sanders has plenty of room to run here in this one. The question becomes whether or not he's going to get the workload. He can be viewed as a high-end RB3.",,,RB18,B,12.0,0.48285714285714293
19624,Antonio Gibson,c0a8a5d0-583f-457a-9d96-70027d3f69e7,WAS,RB,RB,A. Gibson,RB,RB,https://www.fantasypros.com/nfl/players/antonio-gibson.php,antonio-gibson.php,https://images.fantasypros.com/images/players/nfl/19624/headshot/210x210.png,https://images.fantasypros.com/images/players/nfl/19624/headshot/210x210.png,32736,2960976,9,98.5,98.0,99,at GB,GB,,19,15,22,18.07,2.23,"Gibson's status is in question this week. He has a stress fracture in his shin and was shuffled in and out of action last week against the Chiefs, resulting in a disappointing 10-44-0 rushing day against a bad Chiefs run defense. Washington draws another favorable running-game matchup this week, taking on a Packers run D that ranks 30th in Football Outsiders' DVOA metric. If Gibson suits up, you're probably compelled to play him in the Week 7 bye-pocalypse. But of course, there's a chance that the Football Team dials back his snaps again after limiting Gibson to a 39% snap share last week.",,,RB19,B,11.9,0.3315266666666667
15555,Devontae Booker,cd705357-f282-4cbf-8f11-391618d981c3,NYG,RB,RB,D. Booker,RB,RB,https://www.fantasypros.com/nfl/players/devontae-booker.php,devontae-booker.php,https://images.fantasypros.com/images/players/nfl/15555/headshot/210x210.png,https://images.fantasypros.com/images/players/nfl/15555/headshot/210x210.png,29370,2061491,10,71.0,78.9,63,vs. CAR,CAR,,20,15,25,19.70,2.48,"Over his last two contests, Booker has produced yardage totals of 58 and 69 while scoring in just one game. In that span, he's averaged just over 17 touches, so the usage may be there, but he's still a guy who's way overvalued in Week 7. Booker will face a Panthers team that's been the stingiest to opposing RBs this season, and with so many injuries to the receiving corps, Carolina will likely load up to stop the run game. Booker is a low-end RB3 for me this week.",,,RB20,B,11.9,0.4100266666666667
16230,J.D. McKissic,260e8f87-1d08-4c69-8e2b-afa825c1a68a,WAS,RB,RB,J.D. McKissic,RB,RB,https://www.fantasypros.com/nfl/players/jd-mckissic.php,jd-mckissic.php,https://images.fantasypros.com/images/players/nfl/16230/headshot/210x210.png,https://images.fantasypros.com/images/players/nfl/16230/headshot/210x210.png,29650,1886804,9,60.6,58.1,63,at GB,GB,,21,13,25,19.96,1.97,"McKissic figures to get ample work this week regardless of Gibson's status. McKissic has played 46% of Washington's offensive snaps this year and had a season-high 61% snap share last week. He also had a season-high eight carries for 45 yards, although that's probably the absolute single-game carry ceiling for McKissic. What you really care about if you're a McKissic investor is the passing-game usage, and he's averaged a healthy 5.4 targets a game since Week 2. McKissic is a low-end RB2 this week and is appealing in DraftKings contests at an affordable cost of $5,000.",,,RB21,B,11.7,0.2985307692307692
19111,D'Ernest Johnson,f46e812f-14c6-4af8-9316-01a880adebc5,CLE,RB,RB,D. Johnson,RB,RB,https://www.fantasypros.com/nfl/players/dernest-johnson.php,dernest-johnson.php,https://images.fantasypros.com/images/players/nfl/19111/headshot/210x210.png,https://images.fantasypros.com/images/players/nfl/19111/headshot/210x210.png,32608,3117165,13,72.0,71.9,72,vs. DEN,DEN,,22,18,25,22.74,1.58,"The Browns have two of the more talented running backs in the league with Nick Chubb and Kareem Hunt, but that relative embarrassment of RB riches will do them no good this week, with Chubb and Hunt both sidelined with calf injuries. D'Ernest Jackson has been No. 3 on the Browns' RB depth chart and figures to get the start against the Broncos on Thursday night. He's a former undrafted free agent who backed up Marlon Mack for three years at the University of South Florida before rushing for 796 yards and seven touchdowns in a committee role as a senior in 2017. Since entering the league in 2019, he has 40-198-0 rushing and 10-92-0 receiving. Felton, a former UCLA running back who's been playing more of a WR role with the Browns, figures to get some additional snaps, whether out of the backfield or in the slot. Ex-Ram John Kelly has been moved from the practice squad to the active roster and could also factor in. Even with an enhanced role, Johnson is still just a back-end RB2 this week due to all the injuries the Browns are dealing with. Backup QB Case Keenum will be starting for Cleveland, and it's possible they'll be without starting offensive tackles Jedrick Wills and Jack Conklin, who both missed Week 6. Felton and Kelly are long shots to be fantasy-relevant even with enhanced usage.",,,RB22,B-,11.7,0.13868888888888892
