player_id,player_name,sportsdata_id,player_team_id,player_position_id,player_positions,player_short_name,player_eligibility,player_yahoo_positions,player_page_url,player_filename,player_square_image_url,player_image_url,player_yahoo_id,cbs_player_id,player_bye_week,player_owned_avg,player_owned_espn,player_owned_yahoo,player_opponent,player_opponent_id,player_ecr_delta,rank_ecr,rank_min,rank_max,rank_ave,rank_std,note,tag,recommendation,pos_rank,start_sit_grade,r2p_pts,uncertainty
17298,Josh Allen,3069db07-aa43-4503-ab11-2ae5c0002721,BUF,QB,QB,J. Allen,QB,QB,https://www.fantasypros.com/nfl/players/josh-allen-qb.php,josh-allen-qb.php,https://images.fantasypros.com/images/players/nfl/17298/headshot/210x210.png,https://images.fantasypros.com/images/players/nfl/17298/headshot/210x210.png,30977,2181054,7,100.0,99.9,100,vs. ATL,ATL,,1,1,1,1.00,0.00,"A Week 16 matchup against the Patriots had some Allen investors nervous, but he demonstrated why he should never be benched under any circumstances, throwing for 314 yards and three touchdowns, with an additional 64 rushing yards for good measure. Allen is the QB1 in fantasy scoring this year, averaging 24.7 fantasy points per game. He gets a much softer matchup this week against a Falcons pass defense that ranks 27th in opponent passer rating and 29th in DVOA. Allen is the overall QB1 for Week 17 and a good DraftKings value even at a premium price ($8,000).",,,QB1,A+,25.4,0.0
16413,Patrick Mahomes II,11cad59d-90dd-449c-a839-dddaba4fe16c,KC,QB,QB,P. Mahomes II,QB,QB,https://www.fantasypros.com/nfl/players/patrick-mahomes.php,patrick-mahomes.php,https://images.fantasypros.com/images/players/nfl/16413/headshot/210x210.png,https://images.fantasypros.com/images/players/nfl/16413/headshot/210x210.png,30123,2142052,12,100.0,99.9,100,at CIN,CIN,,2,2,3,2.10,0.30,"Mahomes has had an up-and-down season, but he's fallen into a nice groove lately. Over his last three games, he's completed 73.2% of his passes, averaged 308.7 yards per game and 9.2 yards per pass attempt, and thrown eight TD passes and one interception. Mahomes has also run for 52 yards over that stretch. He's the overall QB2 this week against an average Bengals pass defense. That said, it would be hard to spend $7,800 for Mahomes on DraftKings when Josh Allen is only $200 more, has a better matchup and offers more rushing potential.",,,QB2,A,23.2,0.045
9603,Tom Brady,41c44740-d0f6-44ab-8347-3b5d515e5ecf,TB,QB,QB,T. Brady,QB,QB,https://www.fantasypros.com/nfl/players/tom-brady.php,tom-brady.php,https://images.fantasypros.com/images/players/nfl/9603/headshot/210x210.png,https://images.fantasypros.com/images/players/nfl/9603/headshot/210x210.png,5228,187741,9,99.1,99.2,99,at NYJ,NYJ,1.0,3,2,8,4.19,1.57,"A soft Week 17 matchup against the Jets is manna from the heavens for Brady investors. Brady's marvelous season took a turn for the worse in Week 15 when WR Chris Godwin tore his ACL and WR Mike Evans injured his hamstring. Without his top two wide receivers and facing a relentless pass rush from the Saints, Brady threw for 214 yards in that game with no touchdowns and one interception. Last week, Brady got WR Antonio Brown back from an ankle injury and a suspension but turned in mediocre fantasy numbers, throwing for 232 yards with one TD and no interceptions against the Panthers. Even without Godwin and Evans, Brady should be able to feast on a Jets pass defense that ranks 31st in opponent passer rating and 32nd in DVOA. Opposing quarterbacks have completed 69.7% of their passes against the Jets and have averaged 8.2 yards per attempt. Brady is the QB5 this week.",,,QB3,A,22.4,1.23245
9001,Aaron Rodgers,0ce48193-e2fa-466e-a986-33f751add206,GB,QB,QB,A. Rodgers,QB,QB,https://www.fantasypros.com/nfl/players/aaron-rodgers.php,aaron-rodgers.php,https://images.fantasypros.com/images/players/nfl/9001/headshot/210x210.png,https://images.fantasypros.com/images/players/nfl/9001/headshot/210x210.png,7200,419780,13,98.4,97.7,99,vs. MIN,MIN,-1.0,4,3,8,4.58,1.52,"Rodgers has been absolutely picking apart opposing defenses recently. Over Rodgers' last five games, he has 17 total touchdowns and zero interceptions. He's playing like a man on a mission to get the NFL MVP and that's good news for his fantasy managers as they head into championship week. The Vikings' defense derailed Matthew Stafford last week, but Rodgers is going to be able to throw the ball all over the yard here in Week 17. Fire him up as a top-5 QB.",,,QB4,A,21.5,0.7701333333333333
19275,Jalen Hurts,64bd0f02-6a5d-407e-98f1-fd02048ea21d,PHI,QB,QB,J. Hurts,QB,QB,https://www.fantasypros.com/nfl/players/jalen-hurts.php,jalen-hurts.php,https://images.fantasypros.com/images/players/nfl/19275/headshot/210x210.png,https://images.fantasypros.com/images/players/nfl/19275/headshot/210x210.png,32723,2240246,14,95.3,95.6,95,at WAS,WAS,,5,4,9,5.94,1.16,,,,QB5,B+,21.1,0.3364
9451,Matthew Stafford,ade43b1a-0601-4672-83b6-d246bc066a19,LAR,QB,QB,M. Stafford,QB,QB,https://www.fantasypros.com/nfl/players/matthew-stafford.php,matthew-stafford.php,https://images.fantasypros.com/images/players/nfl/9451/headshot/210x210.png,https://images.fantasypros.com/images/players/nfl/9451/headshot/210x210.png,9265,1114942,11,97.3,96.5,98,at BAL,BAL,-1.0,6,3,10,6.06,2.02,"Unfortunately, Stafford wasn't able to come through for fantasy managers last week in a prime situation against the Vikings defense. Minnesota had been bleeding fantasy points to opposing QBs, but he didn't cross over the 200 passing yard threshold and he had just one touchdown to three interceptions. Stafford will look to shake that performance off though this week against the Baltimore secondary that's currently allowing the second most fantasy points to opposing QBs this year. He can be started as a low-end QB1 with upside.",,,QB6,B+,20.8,1.3601333333333334
18635,Justin Herbert,f0a8f8e3-b9e9-46ed-85e4-eec6452a8a44,LAC,QB,QB,J. Herbert,QB,QB,https://www.fantasypros.com/nfl/players/justin-herbert.php,justin-herbert.php,https://images.fantasypros.com/images/players/nfl/18635/headshot/210x210.png,https://images.fantasypros.com/images/players/nfl/18635/headshot/210x210.png,32676,2221960,7,98.7,98.4,99,vs. DEN,DEN,,7,3,9,6.23,1.52,"Herbert was in a smash spot this past week against the Texans, but the Chargers offense sputtered in what turned out to be the most shocking upset of the week. The Texans knocked off the Chargers 41-29 and Los Angeles simply looked shell-shocked, but it still resulted in a top-5 fantasy finish for Herbert due to his talent. Against the Broncos in Week 17, we should see a more prepared and ready Chargers team and Herbert belongs right back in starting lineups as an automatic start. The Broncos are allowing just the third fewest fantasy points to opposing QBs this year, but we know that Herbert has the ability to succeed in any matchup.",,,QB7,B+,20.5,0.7701333333333333
15600,Dak Prescott,86197778-8d4b-4eba-affe-08ef7be7c70b,DAL,QB,QB,D. Prescott,QB,QB,https://www.fantasypros.com/nfl/players/dak-prescott.php,dak-prescott.php,https://images.fantasypros.com/images/players/nfl/15600/headshot/210x210.png,https://images.fantasypros.com/images/players/nfl/15600/headshot/210x210.png,29369,1824864,7,98.4,97.8,99,vs. ARI,ARI,,8,4,10,7.35,1.62,"Welcome back, Dak! After finishing outside the top-20 QBs each of the previous three weeks, Prescott shredded the Washington defense in Week 16 for 330 passing yards and 4 touchdowns, which resulted in 31 total fantasy points and his best fantasy outing of the season. Looking ahead to Week 17, Prescott and the Cowboys have a matchup against the Arizona secondary that has given up 8 passing touchdowns over the past three games to Carson Wentz, Jared Goff, and Matthew Stafford. Dak might not be able to throw for four touchdowns again here, but he should have enough production to be viewed as a viable starter again.",,,QB8,B,20.3,0.6561000000000001
18600,Kyler Murray,dd5a6b6e-ffae-45a5-b8e6-718a9251f374,ARI,QB,QB,K. Murray,QB,QB,https://www.fantasypros.com/nfl/players/kyler-murray.php,kyler-murray.php,https://images.fantasypros.com/images/players/nfl/18600/headshot/210x210.png,https://images.fantasypros.com/images/players/nfl/18600/headshot/210x210.png,31833,2180829,12,99.7,99.4,100,at DAL,DAL,,9,4,10,8.48,1.32,"Murray had had a couple of down performances from a fantasy perspective prior to Week 16, but he rebounded against the Colts and was able to finish as the QB6 on the week. While he wasn't able to do a ton through the air - just 245 passing yards and one total touchdown - he was able to tack on his highest rushing yardage output of the season with 74 yards on the ground. With this threat and ability always in his back pocket, Murray's a consistent starter in fantasy lineups still. It hasn't been stellar through the air here as of late, but we know that Murray has tremendous upside each and every week. The Cowboys are a tough matchup as they're allowing the 5th fewest fantasy points to the position this season, but Murray should be viewed as a safe start. He can be viewed as a mid-range QB1.",,,QB9,B,20.0,0.43560000000000004
19196,Joe Burrow,3023ac10-4e7f-425f-9fc5-2b8e6332c92e,CIN,QB,QB,J. Burrow,QB,QB,https://www.fantasypros.com/nfl/players/joe-burrow.php,joe-burrow.php,https://images.fantasypros.com/images/players/nfl/19196/headshot/210x210.png,https://images.fantasypros.com/images/players/nfl/19196/headshot/210x210.png,32671,2179798,10,90.0,87.0,93,vs. KC,KC,,10,7,11,9.84,0.95,"Last week, Burrow firebombed an injury-ravaged Ravens secondary for 525 passing yards and four touchdowns - both career highs. He gets a much tougher matchup this week against a Chiefs defense that has hit its stride. Kansas City held Ben Roethlisberger to 159 passing yards on 39 attempts last week, with one touchdown and one interception. The last quarterback to throw for 300 yards against the Chiefs was Josh Allen in Week 5. Burrow is the QB8 for the year, and he checks in as the QB9 this week vs. Kansas City.",start,,QB10,B,19.6,0.12892857142857142
20082,Trey Lance,676a508c-c65f-404a-a2b0-f861a4bfd072,SF,QB,QB,T. Lance,QB,QB,https://www.fantasypros.com/nfl/players/trey-lance.php,trey-lance.php,https://images.fantasypros.com/images/players/nfl/20082/headshot/210x210.png,https://images.fantasypros.com/images/players/nfl/20082/headshot/210x210.png,33391,2969444,6,24.1,20.1,28,vs. HOU,HOU,2.0,11,5,15,11.26,1.76,"Lance is likely to get the nod as the starting QB here for San Francisco this week with Jimmy Garoppolo dealing with an injury. If Lance does get the start, he is absolutely worth considering for starting lineups in 1QB leagues due to his rushing upside. In his first start earlier this season, Lance rushed the ball 16 times for 89 yards on the ground and was inches away from finding the end zone that would've vaulted him into the top-12 at the position on the week. Against the Texans defense this week, assuming that Jimmy G is unable to suit up, Lance is a solid start as a low-end QB1 with upside.",start,,QB11,B-,19.2,0.61952
17115,Taysom Hill,3c8a55dd-20a8-4375-b711-49eb5e6e1d0e,NO,QB,QB,T. Hill,QB,QB,https://www.fantasypros.com/nfl/players/taysom-hill.php,taysom-hill.php,https://images.fantasypros.com/images/players/nfl/17115/headshot/210x210.png,https://images.fantasypros.com/images/players/nfl/17115/headshot/210x210.png,30614,2818935,6,47.8,49.5,46,vs. CAR,CAR,,12,11,14,11.87,0.83,"Hill was forced to miss Week 16 due to landing on the COVID list, but there's the possibility that he's cleared in time for this matchup on Sunday. If Hill does play, he's worth considering for your starting lineup due to his rushing ability. The Panthers are allowing the sixth fewest fantasy points to opposing QBs this season, so the upside might not be there for Hill to have a massive performance, but with so many other QBs struggling to make much of a high-level impact for fantasy football recently, Hill's a solid floor play as a high-end QB2.",start,,QB12,B-,18.7,0.06262727272727273
11180,Russell Wilson,409d4cac-ee90-4470-9710-ebe671678339,SEA,QB,QB,R. Wilson,QB,QB,https://www.fantasypros.com/nfl/players/russell-wilson.php,russell-wilson.php,https://images.fantasypros.com/images/players/nfl/11180/headshot/210x210.png,https://images.fantasypros.com/images/players/nfl/11180/headshot/210x210.png,25785,1272242,9,90.4,86.8,94,vs. DET,DET,,13,11,16,13.32,0.96,"Did you know that Wilson has played in 12 games so far this season, but he has finished with more than 250 passing yards in just four of them? He certainly has not produced the way that fantasy managers have come to know and appreciate here this season and he's no longer in the must-start category. With that being said, Wilson should be considered for starting lineups this week against the Lions defense. They've tightened things up recently, but they're still a susceptible defense that talented QBs can take advantage of week in and week out. We'll see if Wilson can rise to the occasion and put up a better performance than what he's done lately. He can be viewed as a low-end QB1/high-end QB2 this week.",start,,QB13,C+,18.2,0.08378181818181818
19297,Tyler Huntley,7c226f73-a59f-4db6-ad98-2766d05d4d5a,BAL,QB,QB,T. Huntley,QB,QB,https://www.fantasypros.com/nfl/players/tyler-huntley.php,tyler-huntley.php,https://images.fantasypros.com/images/players/nfl/19297/headshot/210x210.png,https://images.fantasypros.com/images/players/nfl/19297/headshot/210x210.png,32993,3159137,8,20.0,20.9,19,vs. LAR,LAR,11.0,14,11,24,14.13,2.49,,,,QB14,C,17.5,0.5636454545454547
19198,Tua Tagovailoa,26ad9c27-de38-495e-913c-6fb2428e76d3,MIA,QB,QB,T. Tagovailoa,QB,QB,https://www.fantasypros.com/nfl/players/tua-tagovailoa.php,tua-tagovailoa.php,https://images.fantasypros.com/images/players/nfl/19198/headshot/210x210.png,https://images.fantasypros.com/images/players/nfl/19198/headshot/210x210.png,32675,2741209,14,45.9,49.7,42,at TEN,TEN,,15,13,17,14.84,0.95,"For a team that hasn't run the ball very well this year, the Dolphins have been surprisingly run-heavy of late, passing on only 44% of their offensive snaps the last two weeks. Naturally, cooperative game scripts have weighed into that, with a 31-24 win over the Jets in Week 15 and a 20-3 win over the Saints this past Monday night. Tua attempted 27 passes against the Jets, 26 against the Saints, and finished with just under 200 passing yards in both games. He may be forced to throw a bit more this week against the Titans, who have a pass-funnel defense, Opponents have thrown on the Titans on 64% of their offensive snaps. Tua has been serviceable as a fantasy quarterback in 2021 - no more, no less. He's averaging 15.3 fantasy points in his last five starts. He lands at QB17 in this week's rankings.",sit,,QB15,C,16.9,0.06942307692307692
11174,Ryan Tannehill,5812204c-6dae-4450-8011-99e0f72864ac,TEN,QB,QB,R. Tannehill,QB,QB,https://www.fantasypros.com/nfl/players/ryan-tannehill.php,ryan-tannehill.php,https://images.fantasypros.com/images/players/nfl/11174/headshot/210x210.png,https://images.fantasypros.com/images/players/nfl/11174/headshot/210x210.png,25718,1273654,13,61.4,57.7,65,vs. MIA,MIA,,16,14,18,15.84,0.72,"Tannehill's 2021 fantasy value has largely been sustained with TD runs - he has seven of them - and that's a fragile blueprint for success. Tannehill has thrown just five TD passes in his last seven games, and he's had only two multiple-TD games all season. However, the return of A.J. Brown from a chest injury gives Tannehill a needed lift. With AJB back in the lineup last week in a 20-17 win over the 49ers, Tannehill threw for 209 yards and a touchdown. Brown accounted for 145 of those yards and scored the lone touchdown. The Titans have remained a run-heavy team even with Derrick Henry out, so Tannehill is a dicey fantasy option, but his running ability and Brown's return at least give him a pathway to good fantasy numbers. He's a midrange QB2 this week vs. the Dolphins.",sit,,QB16,C,16.4,0.037028571428571425
12092,Derek Carr,9f026fc0-4449-4dc5-a226-2e2830619381,LV,QB,QB,D. Carr,QB,QB,https://www.fantasypros.com/nfl/players/derek-carr.php,derek-carr.php,https://images.fantasypros.com/images/players/nfl/12092/headshot/210x210.png,https://images.fantasypros.com/images/players/nfl/12092/headshot/210x210.png,27564,1664819,8,57.1,55.2,59,at IND,IND,,17,16,19,17.58,0.83,"As noted in last week's edition of the Primer, the difference in Carr's numbers with and without TE Darren Waller has been stark. Waller has missed the Raiders' last four games with an iliotibial band injury and is now on the COVID-19 list. With Waller, Carr has averaged 310.4 passing yards, with 17 TD passes in 11 games. Without Waller, Carr has averaged 237.3 passing yards, with three TD passes in four games. With Waller likely out again, Carr is slotted at QB20 in this week's rankings.",sit,,QB17,C-,15.8,0.04305625
20156,Mac Jones,1fd00ec3-b758-46d2-a2c1-cca521ea8a54,NE,QB,QB,M. Jones,QB,QB,https://www.fantasypros.com/nfl/players/mac-jones.php,mac-jones.php,https://images.fantasypros.com/images/players/nfl/20156/headshot/210x210.png,https://images.fantasypros.com/images/players/nfl/20156/headshot/210x210.png,33403,2741202,14,27.4,19.8,35,vs. JAC,JAC,,18,16,19,17.94,0.84,"Although Jones' rookie season has been a resounding success, it's hard to trust him for fantasy. He's averaging 13.6 fantasy points per game, which puts him behind the likes of Jared Goff and Baker Mayfield in that category. New England has been run-heavy this season, running on 46% of its offensive snaps. (The league average is 42%.) The Patriots might have the luxury of being even more run-heavy than usual this week, since they're favored by more than two touchdowns at home against the lowly Jaguars. Jones is a low-end QB2 this week.",,,QB18,C-,15.3,0.04409999999999999
15520,Carson Wentz,e9a5c16b-4472-4be9-8030-3f77be7890cb,IND,QB,QB,C. Wentz,QB,QB,https://www.fantasypros.com/nfl/players/carson-wentz.php,carson-wentz.php,https://images.fantasypros.com/images/players/nfl/15520/headshot/210x210.png,https://images.fantasypros.com/images/players/nfl/15520/headshot/210x210.png,29236,1907522,14,42.7,39.3,46,vs. LV,LV,3.0,19,15,38,19.45,4.31,,,,QB19,D+,15.0,1.2384066666666664
9039,Ben Roethlisberger,ea357add-1a41-4a8b-8f34-bbfade7f4d98,PIT,QB,QB,B. Roethlisberger,QB,QB,https://www.fantasypros.com/nfl/players/ben-roethlisberger.php,ben-roethlisberger.php,https://images.fantasypros.com/images/players/nfl/9039/headshot/210x210.png,https://images.fantasypros.com/images/players/nfl/9039/headshot/210x210.png,6770,493043,7,23.3,19.5,27,vs. CLE,CLE,,20,19,22,20.03,0.82,This Steelers offense has completely capsized at this point and Big Ben may be walking into his final game at Heinz Field as a Steeler this week. There's absolutely no reason that we should be considering Ben for our 1QB lineups and he's nothing more than a low-end QB2/high-end QB3 in Superflex leagues.,,,QB20,D,14.8,0.03538947368421052
22799,Davis Mills,7d51fab7-2d52-4d19-a021-19a123af0d10,HOU,QB,QB,D. Mills,QB,QB,https://www.fantasypros.com/nfl/players/davis-mills.php,davis-mills.php,https://images.fantasypros.com/images/players/nfl/22799/headshot/210x210.png,https://images.fantasypros.com/images/players/nfl/22799/headshot/210x210.png,33455,2867381,10,3.6,2.2,5,at SF,SF,,21,19,23,20.90,1.09,"Mills has started to develop nicely here for the Texans recently and he's showing flashes of why they drafted him in the third round of this past draft. Unfortunately, that's still not equating to much fantasy production and we shouldn't be looking his way this week as anything more than a low-end QB2 against San Francisco.",,,QB21,D-,14.5,0.06253157894736842
13932,Taylor Heinicke,2c259733-ec2c-4e3c-bb7b-34dc0d37dc34,WAS,QB,QB,T. Heinicke,QB,QB,https://www.fantasypros.com/nfl/players/taylor-heinicke.php,taylor-heinicke.php,https://images.fantasypros.com/images/players/nfl/13932/headshot/210x210.png,https://images.fantasypros.com/images/players/nfl/13932/headshot/210x210.png,28839,2174914,9,21.3,19.6,23,vs. PHI,PHI,,22,20,27,22.84,1.55,,,,QB22,F,14.2,0.12012500000000001
17237,Baker Mayfield,30198d30-9769-4e10-ac86-b4c91d940802,CLE,QB,QB,B. Mayfield,QB,QB,https://www.fantasypros.com/nfl/players/baker-mayfield.php,baker-mayfield.php,https://images.fantasypros.com/images/players/nfl/17237/headshot/210x210.png,https://images.fantasypros.com/images/players/nfl/17237/headshot/210x210.png,30971,2080032,13,26.4,24.8,28,at PIT,PIT,,23,20,28,22.87,1.84,"Mayfield may not be fully healthy, but the product on the field lately is just simply not good. Over the course of his last five games, he has 7 touchdowns to 8 interceptions and he hasn't finished higher than the QB18 from a fantasy perspective over that time frame. Pittsburgh's defense has been bleeding fantasy points recently, but there's no way we can trust Mayfield in our starting lineups in 1QB leagues. He can be viewed as a low-end QB2.",,,QB23,F,14.0,0.16928
22679,Zach Wilson,17bb63b1-1b0e-48e1-baf7-55cd314d0e62,NYJ,QB,QB,Z. Wilson,QB,QB,https://www.fantasypros.com/nfl/players/zach-wilson.php,zach-wilson.php,https://images.fantasypros.com/images/players/nfl/22679/headshot/210x210.png,https://images.fantasypros.com/images/players/nfl/22679/headshot/210x210.png,33390,2960892,6,6.5,5.0,8,vs. TB,TB,,24,21,26,23.97,1.43,"Wilson turned in his best fantasy finish of the season last week, scoring 23.2 fantasy points to end up as the QB4. He scored nearly half of those points on one play, a swerving 52-yard TD run in the first quarter of a 26-21 win over the Jaguars. Wilson had only 102 passing yards, but his 91 rushing yards more than doubled his season total. Wilson has thrown seven TD passes in 11 games, and he's averaging 183 passing yards. He's the QB28 this week against the Buccaneers.",,,QB24,F,13.7,0.09737619047619046
9444,Matt Ryan,7e648a0b-fdc8-4661-a587-5826f2cac11b,ATL,QB,QB,M. Ryan,QB,QB,https://www.fantasypros.com/nfl/players/matt-ryan.php,matt-ryan.php,https://images.fantasypros.com/images/players/nfl/9444/headshot/210x210.png,https://images.fantasypros.com/images/players/nfl/9444/headshot/210x210.png,8780,420095,6,37.2,29.4,45,at BUF,BUF,,25,23,28,25.16,1.35,"Ryan has gone seven straight games without throwing multiple TD passes. It's either the longest such drought of his career or tied for the longest, depending on whether you're willing to count his final six games of 2017 plus his first game of 2018 as a unified streak. Ryan has averaged 199.7 passing yards over those last seven games, finishing with under 200 passing yards four times during that stretch. The Falcons' passing game has been toothless, and it's not advisable to roll out Ryan this week against a Buffalo pass defense that's allowing a league-low 13.4 fantasy points per game to quarterbacks. Ryan is the QB25 this week.",,,QB25,F,13.4,0.07923913043478262
18225,Drew Lock,94325301-e0ad-4a9f-a0e5-ffec0f529be3,DEN,QB,QB,D. Lock,QB,QB,https://www.fantasypros.com/nfl/players/drew-lock.php,drew-lock.php,https://images.fantasypros.com/images/players/nfl/18225/headshot/210x210.png,https://images.fantasypros.com/images/players/nfl/18225/headshot/210x210.png,31874,2185479,11,1.4,0.8,2,at LAC,LAC,4.0,26,24,34,27.23,2.06,"As we kick off the week, it appears as though Teddy Bridgewater is in danger of missing this next contest as well due to concussion protocol. This puts Lock in line to start again in Week 17, which is a significant downgrade to all of the receiving weapons in this Broncos offense. Last week against the Raiders, Lock completed 15-of-22 passes for just 153 yards. He had zero interceptions, but no touchdowns and the offense failed to make much of an impact on the field. Against the Chargers defense this week, Lock's nothing more than a desperation play in Superflex leagues.",,,QB26,F,13.2,0.17681666666666665
19780,Trevor Lawrence,aaa8b42c-4d87-45f6-bfd2-e31cfed9a736,JAC,QB,QB,T. Lawrence,QB,QB,https://www.fantasypros.com/nfl/players/trevor-lawrence.php,trevor-lawrence.php,https://images.fantasypros.com/images/players/nfl/19780/headshot/210x210.png,https://images.fantasypros.com/images/players/nfl/19780/headshot/210x210.png,33389,2967185,7,24.0,22.0,26,at NE,NE,,27,25,31,28.23,1.58,"Dare we say that Lawrence actually looked pretty good last week in a 26-21 loss to the Jets? He completed 26 of 39 passes for 280 yards, with no touchdowns or interceptions. Lawrence averaged a respectable 7.2 yards per pass attempt, and the yardage total was his highest since Week 6. Still, with just one TD pass in his last eight games, Lawrence is unplayable this week in a bad matchup against the Patriots.",,,QB27,F,12.8,0.09985600000000001
9907,Andy Dalton,d2a0e5af-3850-4f16-8e40-a0b1d15c2ce1,CHI,QB,QB,A. Dalton,QB,QB,https://www.fantasypros.com/nfl/players/andy-dalton.php,andy-dalton.php,https://images.fantasypros.com/images/players/nfl/9907/headshot/210x210.png,https://images.fantasypros.com/images/players/nfl/9907/headshot/210x210.png,24822,1125961,10,1.4,0.7,2,vs. NYG,NYG,,28,22,40,26.27,3.63,"Justin Fields still isn't ready to come back from an ankle injury, so Dalton has been named the Bears' Week 17 starter. He's nothing more than a desperation option in superflex leagues.",,,QB28,F,12.4,0.59895
17236,Sam Darnold,13d826c5-9b22-4e0a-a877-02d8c84c546b,CAR,QB,QB,S. Darnold,QB,QB,https://www.fantasypros.com/nfl/players/sam-darnold.php,sam-darnold.php,https://images.fantasypros.com/images/players/nfl/17236/headshot/210x210.png,https://images.fantasypros.com/images/players/nfl/17236/headshot/210x210.png,30973,2180320,13,5.4,3.8,7,at NO,NO,3.0,29,27,31,28.59,1.27,,,,QB29,F,12.0,0.05973703703703704
