player_id,player_name,sportsdata_id,player_team_id,player_position_id,player_positions,player_short_name,player_eligibility,player_yahoo_positions,player_page_url,player_filename,player_square_image_url,player_image_url,player_yahoo_id,cbs_player_id,player_bye_week,player_owned_avg,player_owned_espn,player_owned_yahoo,player_opponent,player_opponent_id,player_ecr_delta,rank_ecr,rank_min,rank_max,rank_ave,rank_std,note,tag,recommendation,pos_rank,start_sit_grade,r2p_pts,uncertainty
16433,Cooper Kupp,2806e915-c46f-492f-8a29-71d3a85e5620,LAR,WR,WR,C. Kupp,WR,WR,https://www.fantasypros.com/nfl/players/cooper-kupp.php,cooper-kupp.php,https://images.fantasypros.com/images/players/nfl/16433/headshot/210x210.png,https://images.fantasypros.com/images/players/nfl/16433/headshot/210x210.png,30182,2006951,11,100.0,99.9,100,vs. JAC,JAC,,1,1,1,1.00,0.00,"He's gone three games without a touchdown, but Kupp has still been productive during the Rams' current three-game losing streak, with 29-313-0 on 36 targets. Kupp still leads the NFL in catches (92) and receiving yards (1,237), and he's tied with Mike Evans and Adam Thielen for the league lead in TD catches with 10. Kupp is once again the WR1 in this week's rankings, and he's basically a must-have on DraftKings at $9,000.",,,WR1,A+,23.1,0.0
15802,Tyreek Hill,01d8aee3-e1c4-4988-970a-8c0c2d08bd83,KC,WR,WR,T. Hill,WR,WR,https://www.fantasypros.com/nfl/players/tyreek-hill.php,tyreek-hill.php,https://images.fantasypros.com/images/players/nfl/15802/headshot/210x210.png,https://images.fantasypros.com/images/players/nfl/15802/headshot/210x210.png,29399,2131163,12,100.0,99.9,100,vs. DEN,DEN,,2,2,4,2.16,0.51,"Did you know that Hill has more finishes this year outside of the top-12 than he does inside it? In his 11 games this season, Hill has cracked the top-12 just five times and hasn't necessarily brought as much consistency as we once thought was a sure thing. He still obviously comes with week-winning upside in every single matchup, so we're never considering sitting the speedy wideout, but it's interesting to note that he's not exactly as consistent as we might think. Looking ahead to Week 13, the Broncos are middle of the pack when it comes to slowing down opposing WRs and they'll almost assuredly have a plan in place for containing Hill. You're obviously still starting the star WR, but we might need to downgrade him slightly to mid-range WR1 status versus a top-3 option.",,,WR2,A+,20.3,0.13005
19236,Justin Jefferson,4131d4ee-0318-4bb5-832a-4dec80668a4f,MIN,WR,WR,J. Jefferson,WR,WR,https://www.fantasypros.com/nfl/players/justin-jefferson.php,justin-jefferson.php,https://images.fantasypros.com/images/players/nfl/19236/headshot/210x210.png,https://images.fantasypros.com/images/players/nfl/19236/headshot/210x210.png,32692,2871343,7,99.9,99.8,100,at DET,DET,,3,2,4,3.29,0.63,"It's hard to find any sort of issue with Jefferson lately from a fantasy perspective. Over the last four games, he is 7th in the NFL at the WR position in targets, 8th in receptions, 1st in receiving yards, and tied for the second-most receiving touchdowns. On top of all of that, he is the WR1 over that time frame and he's helping lead fantasy rosters to victories. After doing all that, he now is rewarded with about as nice of a matchup as you can find for opposing WRs. He should draw primary coverage this week from Amni Oruwariye, who is allowing a 66% catch rate on the season and 1.13 Yards Per Route Covered. Jefferson's going to put together a solid performance here in Week 13 and he should be viewed as a locked-in top-5 play.",,,WR3,A+,19.8,0.19845000000000002
11616,Keenan Allen,5f424505-f29f-433c-b3f2-1a143a04a010,LAC,WR,WR,K. Allen,WR,WR,https://www.fantasypros.com/nfl/players/keenan-allen.php,keenan-allen.php,https://images.fantasypros.com/images/players/nfl/11616/headshot/210x210.png,https://images.fantasypros.com/images/players/nfl/11616/headshot/210x210.png,26699,1737096,7,99.2,99.4,99,at CIN,CIN,,4,3,9,4.26,1.34,"Allen has been a rock for the Chargers this season, especially over the last month or so. He's drawn double-digit targets in five consecutive games, averaging 8.4 receptions and 95.2 receiving yards over that stretch. Allen has scored only two touchdowns this season and is averaging 11.0 yards per catch, but Allen has one of the safest weekly fantasy floors of any receiver in the league. He has a tricky individual matchup this week against Bengals slot corner Mike Hilton, but Allen is still the WR8 this week and a compelling DraftKings option at $7,500.",,,WR4,A+,18.7,0.5985333333333335
13981,Stefon Diggs,a1c40664-b265-4083-aad2-54b4c734f2c5,BUF,WR,WR,S. Diggs,WR,WR,https://www.fantasypros.com/nfl/players/stefon-diggs.php,stefon-diggs.php,https://images.fantasypros.com/images/players/nfl/13981/headshot/210x210.png,https://images.fantasypros.com/images/players/nfl/13981/headshot/210x210.png,28534,2000038,7,100.0,99.9,100,vs. NE,NE,,5,4,18,6.45,3.01,"After scoring just one touchdown in his first five games of the season, Diggs has scored six TDs in his last six games. He's the WR8 in fantasy scoring, on pace for 1,309 yards and 11 touchdowns. Diggs is probably going to see a lot of Patriots cover man J.C. Jackson Monday night in what should be a terrific individual matchup. Diggs is a midrange WR1 this week.",,,WR5,A+,18.1,2.2650249999999996
16406,Chris Godwin,baa61bb5-f8d0-4f90-bbe2-028576b8d33d,TB,WR,WR,C. Godwin,WR,WR,https://www.fantasypros.com/nfl/players/chris-godwin.php,chris-godwin.php,https://images.fantasypros.com/images/players/nfl/16406/headshot/210x210.png,https://images.fantasypros.com/images/players/nfl/16406/headshot/210x210.png,30197,2818150,9,98.9,98.7,99,at ATL,ATL,,6,4,9,6.74,1.19,"Godwin's drop in production was certainly peculiar last week, but it doesn't seem like it was correlated to his early fumble. Godwin still played 97% of the snaps against the Colts, but he simply took a backseat to Rob Gronkowski. Both Godwin and Evans did very little this past week, but we shouldn't expect that to continue this week against the Falcons. Atlanta is currently allowing 21.8 fantasy points per game to opposing WRs and Godwin went for 4-62-1 the last time these two teams played earlier this season. We should be starting Godwin as a low-end WR1 yet again in Week 13.",,,WR6,A,17.3,0.354025
18615,Diontae Johnson,244c00c7-fe9a-4f4f-adff-1d5b9c8877e7,PIT,WR,WR,D. Johnson,WR,WR,https://www.fantasypros.com/nfl/players/diontae-johnson.php,diontae-johnson.php,https://images.fantasypros.com/images/players/nfl/18615/headshot/210x210.png,https://images.fantasypros.com/images/players/nfl/18615/headshot/210x210.png,31898,2194164,7,97.8,97.5,98,vs. BAL,BAL,,7,5,10,7.00,1.65,"Johnson saw a season-high 14 targets against the Bengals last week, turning them into 9-95-0. It was the eighth time this season that Johnson has seen double-digit targets. He's averaging 80.9 receiving yards per game. Johnson is one of fantasy football's most bankable assets. He won't have an easy individual matchup this weekend against Ravens CB Marlon Humphrey, but Johnson is still a low-end WR1. He's a worthwhile DraftKings cash-game anchor at $6,800.",,,WR7,A,17.3,0.5445
19788,Ja'Marr Chase,fa99e984-d63b-4ef4-a164-407f68a7eeaf,CIN,WR,WR,J. Chase,WR,WR,https://www.fantasypros.com/nfl/players/jamarr-chase.php,jamarr-chase.php,https://images.fantasypros.com/images/players/nfl/19788/headshot/210x210.png,https://images.fantasypros.com/images/players/nfl/19788/headshot/210x210.png,33393,2966320,10,98.5,99.0,98,vs. LAC,LAC,-2.0,8,4,12,7.23,1.93,"Chase investors shouldn't panic over the recent downturn. The explosive rookie has been held to 6-71-1 receiving on nine targets over the last two weeks, but that's largely because the Bengals won their last two games by a combined 50 points. Chase is still a top-five play in season-long leagues and a great value at $7,000 on DraftKings.",,,WR8,A,17.3,0.931225
19202,CeeDee Lamb,a72ea15b-5199-4101-a300-846e1c655add,DAL,WR,WR,C. Lamb,WR,WR,https://www.fantasypros.com/nfl/players/ceedee-lamb.php,ceedee-lamb.php,https://images.fantasypros.com/images/players/nfl/19202/headshot/210x210.png,https://images.fantasypros.com/images/players/nfl/19202/headshot/210x210.png,32687,2865251,7,99.5,98.9,100,at NO,NO,,9,6,14,9.77,1.79,"Lamb appears set to return to the lineup this week against the Saints after dealing with a concussion and he needs to be immediately dropped back into your starting lineup. Lamb has been incredibly consistent this season when he's been in the lineup and he's averaging a solid 7.4 targets, 5 receptions, 74 receiving yards, and .6 touchdowns per game. He has to worry about sharing the ball with multiple other talented receiving threats in this offense, but Lamb has proven that he can get the job done regardless. In a matchup this week against the Saints secondary that's allowing 182.3 receiving yards per game to opposing WRs, which is the 5th highest mark in the league this year, Lamb deserves to be viewed as a low-end WR1.",,,WR9,A,17.3,0.5340166666666667
18466,Terry McLaurin,7e8c4641-2beb-4213-ba22-69fe0307005f,WAS,WR,WR,T. McLaurin,WR,WR,https://www.fantasypros.com/nfl/players/terry-mclaurin.php,terry-mclaurin.php,https://images.fantasypros.com/images/players/nfl/18466/headshot/210x210.png,https://images.fantasypros.com/images/players/nfl/18466/headshot/210x210.png,31908,2139279,9,98.9,98.8,99,at LV,LV,,10,7,12,10.61,1.04,"Continuing a season-long pattern of following up a strong performance with a disappointing one, McLaurin had 4-51-0 against Seattle in Week 12 after putting up 5-103-1 against Carolina a week earlier. This week, McLaurin has a tough individual matchup against Raiders CB Casey Hayward, who's giving up a mere 0.10 fantasy points per route run against him, according to PFF. McLaurin is the WR12 this week, but don't spend $7,400 on him in DraftKings.",,,WR10,A,17.0,0.15451428571428574
12119,Mike Evans,c48c21d9-0ae5-478c-ad34-30a660cfa9b8,TB,WR,WR,M. Evans,WR,WR,https://www.fantasypros.com/nfl/players/mike-evans.php,mike-evans.php,https://images.fantasypros.com/images/players/nfl/12119/headshot/210x210.png,https://images.fantasypros.com/images/players/nfl/12119/headshot/210x210.png,27535,1824909,9,99.5,99.0,100,at ATL,ATL,,11,7,16,11.13,3.13,"The WRs certainly disappointed for Tampa Bay last week. Both Evans and Godwin combined for just 40 yards receiving and they took a clear backseat to Gronkowski in this offense. Evans obviously comes with week-winning upside most weeks though due to his ability to score touchdowns. Through 12 weeks, Evans is tied with Cooper Kupp and Adam Thielen for the league lead in receiving touchdowns with 10, but he is slowly moving towards touchdown-or-bust territory. Evans has seen more than 5 targets in just one of his previous four games. This is also without Antonio Brown active and in the lineup, which could change very soon. He's saved his fantasy performances by finding the end zone in three of those four games, but we need to recognize that the stability might not be there as much as we would hope. With that being said, he's a rock-solid play this week against the Falcons defense that he torched for two touchdowns earlier this season. He can be played as a high-end WR2.",,,WR11,A,16.7,1.3995571428571427
13429,Adam Thielen,2fa2b2da-4aa9-44b5-b27e-56876dfe2ad4,MIN,WR,WR,A. Thielen,WR,WR,https://www.fantasypros.com/nfl/players/adam-thielen.php,adam-thielen.php,https://images.fantasypros.com/images/players/nfl/13429/headshot/210x210.png,https://images.fantasypros.com/images/players/nfl/13429/headshot/210x210.png,27277,2059362,7,98.3,98.5,98,at DET,DET,,12,8,14,12.16,1.25,"Fantasy managers have been critical of Thielen this season, but he's been an incredibly reliable fantasy asset. Over his previous six games, he has yet to finish with less than 7 targets and he has now finished as a top-10 WR each of the past two games. The majority of his production is still dependent upon touchdown production, but we know that Cousins is looking his way when they get down to the red zone. Thielen has now seen 8 targets inside-the-10 this season and he's reeled in all 8 of them - which leads the NFL - for 6 touchdowns. He comes with plenty of upside each week - especially in this matchup - and he is at least providing a decent floor as well. The Lions have tightened things up recently from a fantasy perspective at guarding opposing WRs, but they are not going to have answers for defending this Vikings passing game. Thielen belongs in starting lineups this week as a high-end WR2.",,,WR12,A,16.5,0.1953125
19278,Michael Pittman Jr.,1aefd5e2-1f85-471a-91a5-4aad4cf6fe6d,IND,WR,WR,M. Pittman Jr.,WR,WR,https://www.fantasypros.com/nfl/players/michael-pittman.php,michael-pittman.php,https://images.fantasypros.com/images/players/nfl/19278/headshot/210x210.png,https://images.fantasypros.com/images/players/nfl/19278/headshot/210x210.png,32704,2240188,14,93.3,92.6,94,at HOU,HOU,,13,10,19,12.84,2.17,"It's probably time that we recognize just how dominant Pittman has been this season. After being drafted around the WR50 mark in drafts this past off-season, Pittman is now the WR16 on the season and he's averaging 11.8 Half PPR points per game. He has 61 receptions on the season for 805 yards and 5 touchdowns through 12 games and he was essentially free in drafts. While he's had a few down games here recently, he's still an incredibly consistent WR that's receiving the majority of the targets in Indianapolis. With all that being said, he now gets to take on the Texans defense this week and this is a matchup that you're going to turn right back around and plug him into your starting lineup. The Texans are allowing 173.8 receiving yards per game to opposing WRs and we should see Pittman get back on track here. He can be viewed as a mid-range WR2.",,,WR13,A,16.5,0.47089
18226,Marquise Brown,feeee40a-dd63-41a7-89cd-6c95b5456833,BAL,WR,WR,M. Brown,WR,WR,https://www.fantasypros.com/nfl/players/marquise-brown.php,marquise-brown.php,https://images.fantasypros.com/images/players/nfl/18226/headshot/210x210.png,https://images.fantasypros.com/images/players/nfl/18226/headshot/210x210.png,31857,2804128,8,94.3,94.5,94,at PIT,PIT,,14,12,20,14.65,1.89,"Brown has now seen double-digit targets in four straight games. What's odd is that Brown has largely been used as a short-area receiver in Baltimore's last two games. He had 6-37-0 on 13 targets in a loss to the Dolphins, then 8-51-0 in 10 targets in a 16-10 win over the Browns. Over the last two games, Brown has averaged 6.3 yards per catch and 3.5 yards per target. That's probably just a blip on the radar, but it's certainly not the sort of usage Brown's investors are hoping to see. Brown is a midrange WR2 this week.",start,,WR14,A,16.2,0.29767499999999997
13971,Tyler Lockett,dffa69ad-331e-4f09-ae38-40a5a4406be6,SEA,WR,WR,T. Lockett,WR,WR,https://www.fantasypros.com/nfl/players/tyler-lockett.php,tyler-lockett.php,https://images.fantasypros.com/images/players/nfl/13971/headshot/210x210.png,https://images.fantasypros.com/images/players/nfl/13971/headshot/210x210.png,28457,1860834,9,97.6,97.1,98,vs. SF,SF,,15,11,21,16.55,1.60,"As much as the Seattle passing game has struggled in the three games since Russell Wilson returned from a finger injury, Lockett has still managed to be productive. He had 4-115-0 against Arizona in Week 11 and 3-96-0 against Washington in Week 12. Over the last three games, has averaged 13.0 yards per target. However, Lockett remains mired in a TD slump. He hasn't found the end zone since Week 2. He's the WR17 this week.",start,,WR15,A,16.2,0.23272727272727278
11606,DeAndre Hopkins,5c48ade7-4b9a-4757-9643-87a6e3839e2b,ARI,WR,WR,D. Hopkins,WR,WR,https://www.fantasypros.com/nfl/players/deandre-hopkins.php,deandre-hopkins.php,https://images.fantasypros.com/images/players/nfl/11606/headshot/210x210.png,https://images.fantasypros.com/images/players/nfl/11606/headshot/210x210.png,26650,1737078,12,99.3,99.5,99,at CHI,CHI,,16,10,24,16.65,3.93,"A hamstring injury has kept Hopkins out of action since Week 8, but Cardinals head coach Kliff Kingsbury expressed hope that Hopkins would be back this week against the Bears. A target hog throughout his career, Hopkins hasn't seen double-digit targets in any game this season, as Arizona's QBs have spread the ball around. Hopkins hasn't recorded a 100-yard game in 2021, but he's scored seven touchdowns in eight games. If he plays, Hopkins will be a low-end WR1 or high-end WR2 and an intriguing DraftKings option at a sale price of $6,200.",,,WR16,A,15.9,1.5444900000000001
18345,Hunter Renfrow,34c523c7-bc58-49f0-a9cc-f9edd91fe00f,LV,WR,WR,H. Renfrow,WR,WR,https://www.fantasypros.com/nfl/players/hunter-renfrow.php,hunter-renfrow.php,https://images.fantasypros.com/images/players/nfl/18345/headshot/210x210.png,https://images.fantasypros.com/images/players/nfl/18345/headshot/210x210.png,31981,2144726,8,83.4,85.7,81,vs. WAS,WAS,3.0,17,12,26,17.90,4.18,"Renfrow's sturdy weekly floor has been his greatest attribute in fantasy this season. But now, with Henry Ruggs no longer with the team and Darren Waller banged up, Renfrow's ceiling has been raised, too. He had 8-134-0 against the Cowboys on Thanksgiving, establishing season highs in receptions and yardage. Renfrow is a midrange WR3 this week against Washington, and I'm eagerly buying him at $5,800 on DraftKings.",start,,WR17,A-,15.3,1.456033333333333
19252,Brandon Aiyuk,c90471cc-fa60-4416-9388-5aebb5d877eb,SF,WR,WR,B. Aiyuk,WR,WR,https://www.fantasypros.com/nfl/players/brandon-aiyuk.php,brandon-aiyuk.php,https://images.fantasypros.com/images/players/nfl/19252/headshot/210x210.png,https://images.fantasypros.com/images/players/nfl/19252/headshot/210x210.png,32695,2967489,6,89.3,87.6,91,at SEA,SEA,3.0,18,14,22,18.45,2.14,"With Deebo Samuel out for a week or two with a groin injury, Aiyuk becomes an attractive fantasy option this week against the Seahawks. After an unproductive first half of the season, the second-year receiver from Arizona State has been coming on lately. Over his last four games, Aiyuk has 19-291-2 receiving on 25 targets, with 85 or more receiving yards in three of those four games. Aiyuk hasn't seen more than eight targets in a game all season, but that could change this week with Deebo on the shelf. Aiyuk is a midrange WR2 and an attractive DraftKings money-saver at $5,600.",start,,WR18,A-,15.1,0.32711428571428575
19810,Darnell Mooney,bafe8df1-66b5-4200-8fb3-ff188c25a4e2,CHI,WR,WR,D. Mooney,WR,WR,https://www.fantasypros.com/nfl/players/darnell-mooney.php,darnell-mooney.php,https://images.fantasypros.com/images/players/nfl/19810/headshot/210x210.png,https://images.fantasypros.com/images/players/nfl/19810/headshot/210x210.png,32843,2240651,10,78.9,76.8,81,vs. ARI,ARI,3.0,19,15,24,19.16,2.83,"With Allen Robinson sidelined by a hamstring injury, Mooney has had 5-121-1 and 5-123-0 in Chicago's last two games. Never mind that he's caught 41.7% of his 24 targets in those two games. What matters is that Mooney is being force-fed and cashing in. If Robinson remains sidelined this week, Mooney will be a low-end WR2 and an appealing DraftKings play at $5,600.",start,,WR19,A-,14.8,0.5339266666666667
19790,Jaylen Waddle,0ff9a975-669d-4851-a95d-ab28d9fc29c4,MIA,WR,WR,J. Waddle,WR,WR,https://www.fantasypros.com/nfl/players/jaylen-waddle.php,jaylen-waddle.php,https://images.fantasypros.com/images/players/nfl/19790/headshot/210x210.png,https://images.fantasypros.com/images/players/nfl/19790/headshot/210x210.png,33394,2962110,14,93.3,92.6,94,vs. NYG,NYG,-3.0,20,14,23,19.45,2.00,"Did you know that Jaylen Waddle's 77 receptions are the second most for any player in NFL history through the first 12 games of his career? The only player in history with more receptions through that time period is Odell Beckham Jr. during his historic rookie season where he had 91 receptions through 12 games. Waddle is also fifth in the entire NFL in receptions this season and his 759 receiving yards are good enough for second among all rookies. After being ranked around the WR45 in pre-draft ADP, Waddle is now the WR14 on the year through 12 weeks and he's helping lead fantasy rosters to championships. He's an absolute home-run start every single week at this point and he deserves to be viewed as a mid-range/low-end WR2 in this matchup against the Giants.",start,,WR20,A-,14.7,0.2857142857142857
18219,D.K. Metcalf,754faf0f-40f7-45f0-b23b-6ce990ecaf26,SEA,WR,WR,D.K. Metcalf,WR,WR,https://www.fantasypros.com/nfl/players/dk-metcalf.php,dk-metcalf.php,https://images.fantasypros.com/images/players/nfl/18219/headshot/210x210.png,https://images.fantasypros.com/images/players/nfl/18219/headshot/210x210.png,31896,2260185,9,99.8,99.5,100,vs. SF,SF,-3.0,21,16,23,19.61,2.17,"Through the first eight games of the season, Metcalf had eight touchdowns and was averaging 72.5 receiving yards per game, making him the WR5 in fantasy scoring. That included three and a half games with Geno Smith at quarterback for the Seahawks after Russell Wilson sustained a grisly finger injury. In the three games since Wilson has been back, Metcalf has 8-70-0 on 20 targets. He had one catch for 13 yards Monday night against Washington, and that catch came with 1:06 left in the game. The slumping Metcalf lands at WR18 in this week's rankings and is a DraftKings fade at $6,700.",,,WR21,A-,14.6,0.29430625
19211,Tee Higgins,7963b029-5de4-4541-b00a-44eefe4349af,CIN,WR,WR,T. Higgins,WR,WR,https://www.fantasypros.com/nfl/players/tee-higgins.php,tee-higgins.php,https://images.fantasypros.com/images/players/nfl/19211/headshot/210x210.png,https://images.fantasypros.com/images/players/nfl/19211/headshot/210x210.png,32703,2809208,10,92.4,91.8,93,vs. LAC,LAC,-3.0,22,16,24,20.84,1.87,"Higgins ended a six-game touchdown drought with a pretty 32-yard TD catch against the Steelers last weekend, and he almost had a second touchdown but was tackled just short of the end zone. Higgins' 2021 per-game numbers look a lot like his rookie-year numbers, yet there's a palpable lack of enthusiasm among Higgins stakeholders. Keep playing him. He's a low-end WR2 this week against the Chargers and a good DraftKings value at $5,800.",start,,WR22,A-,14.5,0.21855625000000004
19222,DeVonta Smith,3555d07e-57ae-43de-97d5-b1b5bf055f17,PHI,WR,WR,D. Smith,WR,WR,https://www.fantasypros.com/nfl/players/devonta-smith.php,devonta-smith.php,https://images.fantasypros.com/images/players/nfl/19222/headshot/210x210.png,https://images.fantasypros.com/images/players/nfl/19222/headshot/210x210.png,33398,2866975,14,89.4,87.8,91,at NYJ,NYJ,,23,19,28,24.16,2.10,"We know that Smith is an incredibly talented WR that has the ability to get open at will and provide his QB with a reliable receiving option. With Jalen Hurts out this week with an ankle injury and Gardner Minshew getting the start at quarterback, Smith's outlook might actually brighten a bit, since Minshew might be the better pure passer. The matchup against the Jets is incredibly favorable, so we should continue to start Smith as a high-end WR3, but we need to recognize that the floor is incredibly low if Hurts doesn't get the job done as a passer this week.",start,,WR23,B+,13.6,0.23210526315789473
12122,Brandin Cooks,b6b954eb-4591-4b7a-86b9-a481f15fdd58,HOU,WR,WR,B. Cooks,WR,WR,https://www.fantasypros.com/nfl/players/brandin-cooks.php,brandin-cooks.php,https://images.fantasypros.com/images/players/nfl/12122/headshot/210x210.png,https://images.fantasypros.com/images/players/nfl/12122/headshot/210x210.png,27548,1880880,10,93.2,93.3,93,vs. IND,IND,,24,22,27,24.26,1.54,"Tyrod Taylor has only thrown for 265 passing yards on 50 total pass attempts over the past two weeks combined and that has certainly limited Cooks production from a fantasy standpoint. After seeing 14 targets in Week 9, Cooks has gone on to just see 8 total the past two weeks and he has a combined 63 receiving yards to show for it. While he did score last week to save his fantasy outing, Cooks is not coming with as high of a floor as we had come to expect earlier on in the season. He's still worth playing in this matchup, of course, and we should see the Colts jump out to a large lead which will force more passing volume for the Texans. However, we have to be aware that Cooks isn't bringing as much safety as we once thought. He can be viewed as a high-end WR3 this week.",start,,WR24,B+,12.5,0.10779999999999999
20114,Elijah Moore,b1935e20-6bd6-4863-8d7e-702ec403491f,NYJ,WR,WR,E. Moore,WR,WR,https://www.fantasypros.com/nfl/players/elijah-moore.php,elijah-moore.php,https://images.fantasypros.com/images/players/nfl/20114/headshot/210x210.png,https://images.fantasypros.com/images/players/nfl/20114/headshot/210x210.png,33422,2963569,6,75.5,70.9,80,vs. PHI,PHI,,25,22,31,26.42,2.27,"Moore had been on an absolute tear the few weeks prior to Week 12, but that was without Wilson throwing him the ball. While Moore had double the amount of targets that anyone else did on the Jets last week, it only resulted in 4 receptions for 46 yards and no score in a near-perfect matchup. Now, the Jets take on the Eagles' secondary that is allowing the third-fewest fantasy points to opposing WRs this season with just 15.7 fantasy points per game. We should be exercising caution with Moore this week from a fantasy standpoint and he can be viewed as a mid-range WR3.",start,,WR25,B,12.4,0.23422272727272728
