player_id,player_name,sportsdata_id,player_team_id,player_position_id,player_positions,player_short_name,player_eligibility,player_yahoo_positions,player_page_url,player_filename,player_square_image_url,player_image_url,player_yahoo_id,cbs_player_id,player_bye_week,player_owned_avg,player_owned_espn,player_owned_yahoo,player_opponent,player_opponent_id,player_ecr_delta,rank_ecr,rank_min,rank_max,rank_ave,rank_std,note,tag,recommendation,pos_rank,start_sit_grade,r2p_pts,uncertainty
11594,Travis Kelce,c3859e06-5f23-4302-a71b-04820a899d5f,KC,TE,TE,T. Kelce,TE,TE,https://www.fantasypros.com/nfl/players/travis-kelce.php,travis-kelce.php,https://images.fantasypros.com/images/players/nfl/11594/headshot/210x210.png,https://images.fantasypros.com/images/players/nfl/11594/headshot/210x210.png,26686,1725130,12,100.0,99.9,100,at BAL,BAL,,1,1,4,1.15,0.50,"Kelce is the de facto TE1 every week until he shows that he's no longer deserving of that honor. Coming off a 7/76/2 performance in Week 1, he'll look to keep the momentum going in a clash of AFC powerhouses in Week 2 at Baltimore.",start,,TE1,A+,19.9,0.25
14104,Darren Waller,14c97c9f-26e8-4944-9299-f90de6aeada3,LV,TE,TE,D. Waller,TE,TE,https://www.fantasypros.com/nfl/players/darren-waller.php,darren-waller.php,https://images.fantasypros.com/images/players/nfl/14104/headshot/210x210.png,https://images.fantasypros.com/images/players/nfl/14104/headshot/210x210.png,28592,1850793,8,100.0,99.9,100,at PIT,PIT,,2,1,4,2.06,0.48,"What a machine this guy is. Waller jolted a good Baltimore defense for 105 yards and a touchdown in the Week 1 finale, catching 10 of 19 targets. The Steelers present another tough matchup, but Waller is basically matchup-proof.",,,TE2,A,18.0,0.2304
16499,George Kittle,2ada91b0-036e-454f-83c3-6d939ff584a9,SF,TE,TE,G. Kittle,TE,TE,https://www.fantasypros.com/nfl/players/george-kittle.php,george-kittle.php,https://images.fantasypros.com/images/players/nfl/16499/headshot/210x210.png,https://images.fantasypros.com/images/players/nfl/16499/headshot/210x210.png,30259,2818265,6,100.0,99.9,100,at PHI,PHI,,3,1,7,3.30,0.85,"On Elijah Mitchell's 38-yard touchdown run last Sunday, Kittle actually took TWO Lions defenders off their feet with a single block. It was a play so impressive that we can easily forgive him for ""only"" having four catches for 78 yards in the opener. You're starting Kittle this week, of course.",,,TE3,A,15.8,0.7224999999999999
18290,T.J. Hockenson,bd1120b6-38b3-4225-a4b0-20660a149d0d,DET,TE,TE,T.J. Hockenson,TE,TE,https://www.fantasypros.com/nfl/players/tj-hockenson.php,tj-hockenson.php,https://images.fantasypros.com/images/players/nfl/18290/headshot/210x210.png,https://images.fantasypros.com/images/players/nfl/18290/headshot/210x210.png,31840,2251097,9,98.6,98.2,99,at GB,GB,,4,1,7,3.91,0.92,"Hockenson was expected to see a lot of targets, and that's exactly what happened in Week 1, as he hauled in eight of his 11 looks for 97 yards and a tuddy. Tyrell Williams has been in the concussion protocol this week, and the receiving corps behind him is mighty slim. Hockenson could see even more volume in Lambeau as he takes on a potential Darren Waller-esque voluminous workload. He can safely be penciled in as a top-3 play at his position.",start,,TE4,A-,14.1,0.8464
17269,Mark Andrews,0618f387-9b72-4270-8b8f-dec4cccc9e4a,BAL,TE,TE,M. Andrews,TE,TE,https://www.fantasypros.com/nfl/players/mark-andrews.php,mark-andrews.php,https://images.fantasypros.com/images/players/nfl/17269/headshot/210x210.png,https://images.fantasypros.com/images/players/nfl/17269/headshot/210x210.png,31056,2131121,8,99.1,99.1,99,vs. KC,KC,,5,3,11,5.66,1.75,"In a Monday-night affair where Raiders TE Darren Waller saw 15 targets and finished with 105 yards and a touchdown, the Ravens' pass-catching tight end was strangely quiet. Andrews was targeted five times against Las Vegas and had three catches for 20 yards. As with teammate Marquise Brown, Andrews doesn't have an illustrious record in games against Kansas City. In three meetings with the Chiefs, Andrews has caught 6 of 17 targets for 37 yards and no touchdowns.",,,TE5,B+,13.4,1.0208333333333333
17527,Noah Fant,cdc98acc-9eb6-4b44-81bb-61d7b8a3b55f,DEN,TE,TE,N. Fant,TE,TE,https://www.fantasypros.com/nfl/players/noah-fant.php,noah-fant.php,https://images.fantasypros.com/images/players/nfl/17527/headshot/210x210.png,https://images.fantasypros.com/images/players/nfl/17527/headshot/210x210.png,31852,2251095,11,92.8,91.6,94,at JAC,JAC,,6,4,11,7.00,1.47,"Fant was already an appealing tight end if you missed out on one of the bigger names at the position. He's a terrific athlete and is a tough matchup for whoever's trying to cover him. This week, that problematic assignment goes to Jacksonville safety Rayshawn Jenkins, a competent defender. Fant was heavily involved in Week 1, catching 6 of 8 targets for 62 yards. The Broncos might ratchet up his involvement even more with Jerry Jeudy out, making Fant a slam-dunk TE1 this week.",start,,TE6,B,13.2,0.540225
12095,Logan Thomas,b24625a0-d402-4d59-a778-aa4b073bfe5e,WAS,TE,TE,L. Thomas,TE,TE,https://www.fantasypros.com/nfl/players/logan-thomas.php,logan-thomas.php,https://images.fantasypros.com/images/players/nfl/12095/headshot/210x210.png,https://images.fantasypros.com/images/players/nfl/12095/headshot/210x210.png,27648,1691193,9,95.8,95.5,96,vs. NYG,NYG,,7,4,14,7.37,1.75,"Washington's lone Week 1 touchdown belonged to Thomas, who made a nice high-point grab of an 11-yard throw from Taylor Heinicke. Thomas wasn't especially effective in two games against the Giants last year (3-42-1 and 3-28-0), but those were a pair of midseason games played before Thomas caught fire down the stretch.",,,TE7,B,12.4,0.765625
20164,Kyle Pitts,1f3deb24-9ff8-4769-8f42-825eff7742f6,ATL,TE,TE,K. Pitts,TE,TE,https://www.fantasypros.com/nfl/players/kyle-pitts.php,kyle-pitts.php,https://images.fantasypros.com/images/players/nfl/20164/headshot/210x210.png,https://images.fantasypros.com/images/players/nfl/20164/headshot/210x210.png,33392,2964514,6,98.6,98.2,99,at TB,TB,,8,4,13,7.41,1.62,"Don't read too much into Pitts' disappointing NFL debut. The Falcons' offense was stymied most of the afternoon, but the Florida product tied for the team lead in targets with eight. The Bucs are a much easier team to throw on than run on, so I'd expect Matty Ice to be slinging the ball early and often. That could mean a breakout game for the rookie. Continue to play him as a top-6 option at TE.",start,,TE8,B,11.4,0.6561000000000001
15623,Tyler Higbee,0df7912d-9e81-47ea-b4f7-d04986df4ee8,LAR,TE,TE,T. Higbee,TE,TE,https://www.fantasypros.com/nfl/players/tyler-higbee.php,tyler-higbee.php,https://images.fantasypros.com/images/players/nfl/15623/headshot/210x210.png,https://images.fantasypros.com/images/players/nfl/15623/headshot/210x210.png,29344,1853103,11,85.7,75.3,96,at IND,IND,2.0,9,5,17,9.69,2.24,"There's a good chance we'll get a TE1 season out of Higbee if his Week 1 usage is any indication of how the season will go. He was in on all 52 of the Rams' offensive snaps, and he caught 5 of 6 targets for 68 yards. That's iron-man stuff, and maybe we'll continue to see the massive target counts for Higbee now that Gerald Everett has left for Seattle.",,,TE9,B-,11.0,1.0035200000000002
9721,Rob Gronkowski,2142a164-48ad-47d6-bb27-0bc58c6b2e62,TB,TE,TE,R. Gronkowski,TE,TE,https://www.fantasypros.com/nfl/players/rob-gronkowski.php,rob-gronkowski.php,https://images.fantasypros.com/images/players/nfl/9721/headshot/210x210.png,https://images.fantasypros.com/images/players/nfl/9721/headshot/210x210.png,24017,1244303,9,93.2,92.3,94,vs. ATL,ATL,,10,4,18,9.90,2.20,"Gronk finished as the TE1 last week thanks to his 8/90/2 line that helped the Bucs eek out a win over the Cowboys on TNF. With TB's offense humming and a years-old connection with Tom Brady (they just hooked up for their 100th TD for crying out loud!), Gronk belongs in the weekly top-10 until further notice.",start,,TE10,B-,10.8,1.2100000000000002
17270,Dallas Goedert,e8029983-87cf-49a2-bc04-04c8233a0630,PHI,TE,TE,D. Goedert,TE,TE,https://www.fantasypros.com/nfl/players/dallas-goedert.php,dallas-goedert.php,https://images.fantasypros.com/images/players/nfl/17270/headshot/210x210.png,https://images.fantasypros.com/images/players/nfl/17270/headshot/210x210.png,31019,2132551,14,90.3,89.5,91,vs. SF,SF,-2.0,11,8,16,10.83,1.97,"As expected, the Eagles used plenty of two-TE sets in their opener, so Goedert wound up with a 73% snap share, Ertz a 58% share. Goedert caught 4 of 5 targets for 42 yards and a score. Ertz hauled in both of his targets for 34 yards. The 49ers have a nice pair of safeties, and their linebackers are good in coverage, so this doesn't seem to be a great matchup for the Philly TEs. But then again, Lions TE T.J. Hockenson hung 97 yards and a touchdown on the Eagles last week.",,,TE11,C+,10.5,0.4851125
16502,Robert Tonyan,7c9c7800-69d0-459b-812b-a07ac48e9f2a,GB,TE,TE,R. Tonyan,TE,TE,https://www.fantasypros.com/nfl/players/robert-tonyan.php,robert-tonyan.php,https://images.fantasypros.com/images/players/nfl/16502/headshot/210x210.png,https://images.fantasypros.com/images/players/nfl/16502/headshot/210x210.png,30777,2820026,13,88.0,84.9,91,vs. DET,DET,,12,7,20,12.92,2.42,"We knew Tonyan would be a TD-dependent option heading into the season (how many TE's aren't, am I right?), so Week 1's dud shouldn't freak you out. He was targeted four times (more than his per-game average from a season ago) but failed to find the end zone. Keep rolling with him in Week 2 as a mid-range TE1, and hope for a score.",start,,TE12,C,9.6,0.8366285714285714
16460,Jonnu Smith,e4f25a37-74de-4bfb-b6c9-f50a4fab0b87,NE,TE,TE,J. Smith,TE,TE,https://www.fantasypros.com/nfl/players/jonnu-smith.php,jonnu-smith.php,https://images.fantasypros.com/images/players/nfl/16460/headshot/210x210.png,https://images.fantasypros.com/images/players/nfl/16460/headshot/210x210.png,30213,2081506,14,74.0,80.0,68,at NYJ,NYJ,,13,8,20,13.47,2.44,"The Patriots gave these two tight ends a combined seven years and $87.4 million in free agency back in March, and they both had decent starts with their new team. Smith caught 5 of 5 targets for 42 yards. Henry caught 3 of 3 targets for 31 yards. The Jets have issues at linebacker and in the secondary, so either Smith or Henry (or perhaps both) could erupt. I have Smith at TE9, safely within TE1 range, and Henry is just outside it at TE13.",,,TE13,C-,9.6,0.7442
9265,Jared Cook,3b7a1409-d154-4e5c-8c94-9d4a0e0993c7,LAC,TE,TE,J. Cook,TE,TE,https://www.fantasypros.com/nfl/players/jared-cook.php,jared-cook.php,https://images.fantasypros.com/images/players/nfl/9265/headshot/210x210.png,https://images.fantasypros.com/images/players/nfl/9265/headshot/210x210.png,9353,584314,7,45.1,49.1,41,vs. DAL,DAL,,14,7,19,13.49,2.78,"Need a tight end? Cook is only 36% rostered in Yahoo leagues, and his Week 1 usage was encouraging. He only played six more snaps than Donald Parham but was targeted eight times and had five grabs for 56 yards. Buccaneers TE Rob Gronkowski lit up Dallas for 90 yards and two TDs in Week 1.",,,TE14,C,9.5,1.1040571428571426
19229,Cole Kmet,036feeb6-9a22-43c5-a8e3-7ac611d8ff49,CHI,TE,TE,C. Kmet,TE,TE,https://www.fantasypros.com/nfl/players/cole-kmet.php,cole-kmet.php,https://images.fantasypros.com/images/players/nfl/19229/headshot/210x210.png,https://images.fantasypros.com/images/players/nfl/19229/headshot/210x210.png,32713,2868619,10,33.3,27.5,39,vs. CIN,CIN,,15,11,26,15.36,2.58,"Kmet is a player to target. He started winning the weekly snap battle against teammate Jimmy Graham late last year, and now he's left Graham in the dust. Kmet played 51 of 69 Week 1 snaps. Graham played 14. Kmet's five-catch, 42-yard stat line doesn't quicken pulses, but a seven-target game is going to be a lot more valuable when the Bears inevitably change quarterbacks and upgrade from Andy Dalton to Justin Fields. Pick up or trade for Kmet while you can still do so affordably.",,,TE15,D+,8.3,0.6051272727272727
16459,Gerald Everett,ebeceb00-57e0-4b74-9cf7-853da2afed18,SEA,TE,TE,G. Everett,TE,TE,https://www.fantasypros.com/nfl/players/gerald-everett.php,gerald-everett.php,https://images.fantasypros.com/images/players/nfl/16459/headshot/210x210.png,https://images.fantasypros.com/images/players/nfl/16459/headshot/210x210.png,30157,2142692,9,39.6,14.1,65,vs. TEN,TEN,,16,10,26,16.08,2.20,"He only drew two targets in his first game with Seattle, but Everett has 20 yards and a touchdown. Seattle's new offense seems like a nice fit for Everett, but we'd like to see him get more than two targets in Week 2.",,,TE16,D+,8.3,0.4840000000000001
15581,Austin Hooper,90c2a93f-d837-4e1b-b57c-56648903a8db,CLE,TE,TE,A. Hooper,TE,TE,https://www.fantasypros.com/nfl/players/austin-hooper.php,austin-hooper.php,https://images.fantasypros.com/images/players/nfl/15581/headshot/210x210.png,https://images.fantasypros.com/images/players/nfl/15581/headshot/210x210.png,29315,2067004,13,49.2,50.3,48,vs. HOU,HOU,,17,13,35,18.24,3.37,"All signs pointed to Austin Hooper having a good game last week, but there was the potential that he didn't see the majority of the targets and that they would fall to one of the other TE options in this Cleveland offense. That happened this past week with David Njoku stepping in and seeing five targets to Hooper's three. Moving forward, there's simply not going to be the consistency that we need from Hooper to trust him in our starting lineups. If he were the sole option in this offense, he'd be in consideration for the top-12 TEs every single week. However, we simply don't know what we're going to get every week and that leads Hooper to fall outside of the top-15 in my TE rankings for week two. Njoku had a good game last week and could be the main receiving TE in this offense, but his usage isn't enough to trust him quite yet. Njoku only ran 16 receiving routes in week one, which isn't anywhere near enough for what we need to confidently start him, especially with Hooper in this TE room as well. Njoku also falls outside my top-15 TEs on the week.",,,TE17,D,7.4,0.8736076923076924
15561,Hunter Henry,705899da-3c20-4bc3-b5d0-2e6e40655131,NE,TE,TE,H. Henry,TE,TE,https://www.fantasypros.com/nfl/players/hunter-henry.php,hunter-henry.php,https://images.fantasypros.com/images/players/nfl/15561/headshot/210x210.png,https://images.fantasypros.com/images/players/nfl/15561/headshot/210x210.png,29269,2079848,14,46.4,39.7,53,at NYJ,NYJ,,18,13,36,18.42,2.99,"The Patriots gave these two tight ends a combined seven years and $87.4 million in free agency back in March, and they both had decent starts with their new team. Smith caught 5 of 5 targets for 42 yards. Henry caught 3 of 3 targets for 31 yards. The Jets have issues at linebacker and in the secondary, so either Smith or Henry (or perhaps both) could erupt. I have Smith at TE9, safely within TE1 range, and Henry is just outside it at TE13.",start,,TE18,D,7.4,0.6877000000000001
17272,Mike Gesicki,1012cbe0-7eba-4169-bfca-183a0204e1a7,MIA,TE,TE,M. Gesicki,TE,TE,https://www.fantasypros.com/nfl/players/mike-gesicki.php,mike-gesicki.php,https://images.fantasypros.com/images/players/nfl/17272/headshot/210x210.png,https://images.fantasypros.com/images/players/nfl/17272/headshot/210x210.png,31012,2139298,14,67.7,71.4,64,vs. BUF,BUF,,19,13,37,19.13,3.63,"It's time to ditch Gesicki. He played just 39% of Miami's offensive snaps in Week 1, while fellow TE Durham Smythe, a superior blocker, played 70% of the snaps. And now Will Fuller is back, which will increase the Dolphins' usage of three-WR sets. I have Gesicki ranked TE19 this week, and even that feels overly optimistic.",,,TE19,D-,7.4,1.0136076923076922
17598,Tyler Conklin,f0d17dfa-ebf3-416c-a8d2-c6bc30675103,MIN,TE,TE,T. Conklin,TE,TE,https://www.fantasypros.com/nfl/players/tyler-conklin.php,tyler-conklin.php,https://images.fantasypros.com/images/players/nfl/17598/headshot/210x210.png,https://images.fantasypros.com/images/players/nfl/17598/headshot/210x210.png,31127,2165249,7,3.6,3.1,4,at ARI,ARI,,20,18,41,23.61,4.03,"Tyler Conklin came through with a decent fantasy performance in week one, so he's worth monitoring on the waiver wire moving forward in case he carves out a significant role for himself, but we shouldn't be looking his way for starting lineups just yet.",,,TE20,F,7.3,0.9022722222222224
16638,Blake Jarwin,43e8a6ac-d451-4dbd-b145-797764f91494,DAL,TE,TE,B. Jarwin,TE,TE,https://www.fantasypros.com/nfl/players/blake-jarwin.php,blake-jarwin.php,https://images.fantasypros.com/images/players/nfl/16638/headshot/210x210.png,https://images.fantasypros.com/images/players/nfl/16638/headshot/210x210.png,30784,2819999,7,9.8,7.5,12,at LAC,LAC,,21,16,42,25.34,4.10,"Jarwin was the more popular Dallas tight end during draft season, but Schultz might be the more valuable asset. Schultz out-snapped Jarwin 57-48 in the opener, catching all six of his targets for 45 yards. Jarwin caught 3 of 3 targets for 20 yards. It's possible that the Michael Gallup injury funnels a few extra targets to the Cowboys' tight ends in the weeks to come, but the relatively even allotment of snaps could damage the value of both.",,,TE21,F,6.7,1.050625
11689,Zach Ertz,de3421f7-2147-4835-89a5-724e87bad463,PHI,TE,TE,Z. Ertz,TE,TE,https://www.fantasypros.com/nfl/players/zach-ertz.php,zach-ertz.php,https://images.fantasypros.com/images/players/nfl/11689/headshot/210x210.png,https://images.fantasypros.com/images/players/nfl/11689/headshot/210x210.png,26658,1685963,14,25.6,21.1,30,vs. SF,SF,,22,14,46,23.32,4.43,,,,TE22,F,6.7,1.401778571428571
16787,Anthony Firkser,b0719e3d-199b-46e5-a2b4-1091f6fd5c0d,TEN,TE,TE,A. Firkser,TE,TE,https://www.fantasypros.com/nfl/players/anthony-firkser.php,anthony-firkser.php,https://images.fantasypros.com/images/players/nfl/16787/headshot/210x210.png,https://images.fantasypros.com/images/players/nfl/16787/headshot/210x210.png,30571,2818971,13,11.0,10.9,11,at SEA,SEA,,23,13,39,24.58,4.37,"Firkser only played 48% of the Titans' offensive snaps, sharing TE snaps with Geoff Swaim and MyCole Pruitt. Firkser did see four targets and had three catches for 19 yards. With the amount of oxygen that A.J. Brown and Julio Jones are going to suck up in an offense that probably isn't going to produce stratospheric passing totals, Firkser isn't a very appealing TE option.",,,TE23,F,6.7,1.4689923076923077
19562,Juwan Johnson,0226b03b-f91d-4223-9813-9fcd2e9c3acc,NO,TE,TE,J. Johnson,"WR,TE","WR,TE",https://www.fantasypros.com/nfl/players/juwan-johnson.php,juwan-johnson.php,https://images.fantasypros.com/images/players/nfl/19562/headshot/210x210.png,https://images.fantasypros.com/images/players/nfl/19562/headshot/210x210.png,33113,2186637,6,25.6,13.2,38,at CAR,CAR,,24,14,41,25.13,5.68,"With the Saints currently thin at wide receiver, this could become a TE-centric offense for a while. We saw some of that against Green Bay, although the lopsided score may have muted the effect a bit. Trautman played 51 of 62 snaps. He ran routes on only 35% of those snaps, but again ... blowout. Johnson played only 12 snaps but ran routes on 10 of them. He caught all three of his targets for 21 yards and two touchdowns. Puny snap counts could scare people away from Johnson, but if he's running routes on the vast majority of his snaps - and things seem to be pointing that way - then he could be a useful fantasy option. Johnson's emergence of training camp seemed to turn people away from Trautman, but Trautman's big snap share is a good sign. New Orleans is now fertile ground for TE speculators.",,,TE24,F,6.6,2.3044571428571428
17349,Dalton Schultz,8caec1b4-e0b6-4a84-b8c8-617d6e91ef6a,DAL,TE,TE,D. Schultz,TE,TE,https://www.fantasypros.com/nfl/players/dalton-schultz.php,dalton-schultz.php,https://images.fantasypros.com/images/players/nfl/17349/headshot/210x210.png,https://images.fantasypros.com/images/players/nfl/17349/headshot/210x210.png,31107,2136748,7,2.6,3.1,2,at LAC,LAC,,25,13,38,24.17,4.69,"Jarwin was the more popular Dallas tight end during draft season, but Schultz might be the more valuable asset. Schultz out-snapped Jarwin 57-48 in the opener, catching all six of his targets for 45 yards. Jarwin caught 3 of 3 targets for 20 yards. It's possible that the Michael Gallup injury funnels a few extra targets to the Cowboys' tight ends in the weeks to come, but the relatively even allotment of snaps could damage the value of both.",,,TE25,F,6.5,1.6920076923076925
12143,Eric Ebron,9fbcfae9-dd14-415c-8952-9b1b5dff0dfc,PIT,TE,TE,E. Ebron,TE,TE,https://www.fantasypros.com/nfl/players/eric-ebron.php,eric-ebron.php,https://images.fantasypros.com/images/players/nfl/12143/headshot/210x210.png,https://images.fantasypros.com/images/players/nfl/12143/headshot/210x210.png,27538,1865396,7,15.5,24.0,7,vs. LV,LV,,26,16,43,27.75,4.57,"The arrival of Freiermuth in Pittsburgh is going to make Ebron widely available on waivers. The rookie from Penn State out-snapped Ebron 29-27, and that gap is probably going to widen as the season wears on. Neither guy is playable for now, but Freiermuth is more likely to warrant a start a month from now.",,,TE26,F,6.4,1.3053062500000001
17283,Hayden Hurst,1b125fc4-5dd9-4eb9-a42f-048e61ca42b7,ATL,TE,TE,H. Hurst,TE,TE,https://www.fantasypros.com/nfl/players/hayden-hurst.php,hayden-hurst.php,https://images.fantasypros.com/images/players/nfl/17283/headshot/210x210.png,https://images.fantasypros.com/images/players/nfl/17283/headshot/210x210.png,30995,2185053,6,2.4,1.8,3,at TB,TB,,27,18,42,30.22,4.24,,,,TE27,F,6.4,0.9987555555555557
18631,Dawson Knox,5fb525c5-4e70-4ede-8c49-94ad0cf66b7d,BUF,TE,TE,D. Knox,TE,TE,https://www.fantasypros.com/nfl/players/dawson-knox.php,dawson-knox.php,https://images.fantasypros.com/images/players/nfl/18631/headshot/210x210.png,https://images.fantasypros.com/images/players/nfl/18631/headshot/210x210.png,31928,2186345,7,4.6,3.1,6,at MIA,MIA,,28,21,44,29.01,3.90,"He's an athletic young player who has the Buffalo TE gig mostly all to himself, but Knox has topped 50 yards in only one of his last 16 games with the Bills, playoffs included - and in that game he just barely cleared the bar with 51 yards.",,,TE28,F,6.1,0.7242857142857142
9906,Kyle Rudolph,1059e9dc-97df-4643-9116-883a0573d8b1,NYG,TE,TE,K. Rudolph,TE,TE,https://www.fantasypros.com/nfl/players/kyle-rudolph.php,kyle-rudolph.php,https://images.fantasypros.com/images/players/nfl/9906/headshot/210x210.png,https://images.fantasypros.com/images/players/nfl/9906/headshot/210x210.png,24830,1633122,10,0.9,0.8,1,at WAS,WAS,,29,20,40,29.43,3.43,,,,TE29,F,5.9,0.588245
13960,Tyler Kroft,36f54823-9d51-4180-9c91-d10281deb4bf,NYJ,TE,TE,T. Kroft,TE,TE,https://www.fantasypros.com/nfl/players/tyler-kroft.php,tyler-kroft.php,https://images.fantasypros.com/images/players/nfl/13960/headshot/210x210.png,https://images.fantasypros.com/images/players/nfl/13960/headshot/210x210.png,28473,1824200,6,0.8,0.6,1,vs. NE,NE,,30,20,43,30.79,3.82,"It seemed as if Kroft might be a decent streamer TE option this year, but Griffin's involvement may put the kibosh on that notion. Kroft played two-thirds of the snaps in the Jets' opener, catching 3 of 5 targets for 26 yards. Griffin played 48% of the snaps and caught 3 of 6 targets for 22 yards. With Kroft not commanding a greater share of TE snaps and targets in this offense, there's no reason to invest.",,,TE30,F,5.7,0.7296199999999999
19423,Adam Trautman,4e14183b-f974-4745-9d7f-8f5eb2a92a7d,NO,TE,TE,A. Trautman,TE,TE,https://www.fantasypros.com/nfl/players/adam-trautman.php,adam-trautman.php,https://images.fantasypros.com/images/players/nfl/19423/headshot/210x210.png,https://images.fantasypros.com/images/players/nfl/19423/headshot/210x210.png,32775,2182228,6,7.5,5.0,10,at CAR,CAR,,31,13,46,23.04,6.90,"With the Saints currently thin at wide receiver, this could become a TE-centric offense for a while. We saw some of that against Green Bay, although the lopsided score may have muted the effect a bit. Trautman played 51 of 62 snaps. He ran routes on only 35% of those snaps, but again ... blowout. Johnson played only 12 snaps but ran routes on 10 of them. He caught all three of his targets for 21 yards and two touchdowns. Puny snap counts could scare people away from Johnson, but if he's running routes on the vast majority of his snaps - and things seem to be pointing that way - then he could be a useful fantasy option. Johnson's emergence of training camp seemed to turn people away from Trautman, but Trautman's big snap share is a good sign. New Orleans is now fertile ground for TE speculators.",,,TE31,F,5.7,3.6623076923076927
14084,C.J. Uzomah,19858900-5c8e-49a7-ab02-34ef625724ca,CIN,TE,TE,C.J. Uzomah,TE,TE,https://www.fantasypros.com/nfl/players/cj-uzomah.php,cj-uzomah.php,https://images.fantasypros.com/images/players/nfl/14084/headshot/210x210.png,https://images.fantasypros.com/images/players/nfl/14084/headshot/210x210.png,28545,2174118,10,0.8,0.8,0,at CHI,CHI,,32,19,46,33.34,3.47,,,,TE32,F,5.6,0.6337315789473684
17143,Dan Arnold,d479a777-b53b-4bbf-a8e4-0c1675ac48df,CAR,TE,TE,D. Arnold,TE,TE,https://www.fantasypros.com/nfl/players/dan-arnold.php,dan-arnold.php,https://images.fantasypros.com/images/players/nfl/17143/headshot/210x210.png,https://images.fantasypros.com/images/players/nfl/17143/headshot/210x210.png,30891,2835170,13,2.4,0.7,4,vs. NO,NO,,33,25,45,34.78,4.36,"Dan Arnold has an opportunity to step up in this Panthers offense, but based on what we saw last week, it's unlikely to happen just yet. Arnold can be dropped to the waiver wire in most formats.",,,TE33,F,5.5,0.7603840000000001
