player_id,player_name,sportsdata_id,player_team_id,player_position_id,player_positions,player_short_name,player_eligibility,player_yahoo_positions,player_page_url,player_filename,player_square_image_url,player_image_url,player_yahoo_id,cbs_player_id,player_bye_week,player_owned_avg,player_owned_espn,player_owned_yahoo,player_opponent,player_opponent_id,player_ecr_delta,rank_ecr,rank_min,rank_max,rank_ave,rank_std,note,tag,recommendation,pos_rank,start_sit_grade,r2p_pts,uncertainty
16483,Austin Ekeler,e5b8c439-a48a-4f83-b63b-1a4d30e04cd3,LAC,RB,RB,A. Ekeler,RB,RB,https://www.fantasypros.com/nfl/players/austin-ekeler.php,austin-ekeler.php,https://images.fantasypros.com/images/players/nfl/16483/headshot/210x210.png,https://images.fantasypros.com/images/players/nfl/16483/headshot/210x210.png,30423,2820090,7,99.9,99.8,100,at BAL,BAL,,1,1,5,1.85,1.28,"Ekeler has logged at least 17 touches in each of his last three games, including a season-high 22 in Week 5. But talking about his touches to open this blurb is really burying the lead: Ekeler has scored six times in that span. Yep, six! Continue to lock him into lineups as a top-5 play each and every week.",start,,RB1,A+,21.1,1.6384
15514,Derrick Henry,87c481c7-7414-43cc-82df-19ca0c2ae22e,TEN,RB,RB,D. Henry,RB,RB,https://www.fantasypros.com/nfl/players/derrick-henry.php,derrick-henry.php,https://images.fantasypros.com/images/players/nfl/15514/headshot/210x210.png,https://images.fantasypros.com/images/players/nfl/15514/headshot/210x210.png,29279,2061188,13,100.0,99.9,100,vs. BUF,BUF,,2,1,9,2.34,1.54,"Fantasy's numero uno RB has rolled opposing defenses this season. Only problem is, he hasn't faced a defense like Buffalo's yet. This Bills defense is no joke, and Henry falls outside my top-5 RBs for the week against a team that has allowed the second-fewest points to opposing backs this season.",start,,RB2,A+,20.3,2.3716
15498,Ezekiel Elliott,bef8b2b4-78bd-4a4d-bb5d-6b55ada9ef6a,DAL,RB,RB,E. Elliott,RB,RB,https://www.fantasypros.com/nfl/players/ezekiel-elliott.php,ezekiel-elliott.php,https://images.fantasypros.com/images/players/nfl/15498/headshot/210x210.png,https://images.fantasypros.com/images/players/nfl/15498/headshot/210x210.png,29238,2060769,7,99.9,99.7,100,at NE,NE,,3,1,8,3.61,1.36,"Zeke has put up some massive numbers over his last four games, and there's no reason to believe that changes in Week 6 even against a better-than-average Patriots run defense.",start,,RB3,A+,19.9,1.8496000000000004
19302,Najee Harris,48ec58c3-ec26-4434-b005-8d34035e6667,PIT,RB,RB,N. Harris,RB,RB,https://www.fantasypros.com/nfl/players/najee-harris-rb.php,najee-harris-rb.php,https://images.fantasypros.com/images/players/nfl/19302/headshot/210x210.png,https://images.fantasypros.com/images/players/nfl/19302/headshot/210x210.png,33412,2741200,7,99.9,99.8,100,vs. SEA,SEA,,4,1,9,4.46,2.01,"The big rookie has been a true workhorse for Pittsburgh. He had a season-high 23 carries for 122 yards and a touchdown last week against the Broncos. He ranks seventh in the league in carries with 78, and his 28 receptions rank second among RBs, putting him just one catch behind D'Andre Swift. Harris's 14-catch day in Week 3 was far more valuable than his 23-carry day in Week 5, but his investors certainly won't complain about the latter. (And Harris added two receptions in Week 5 for good measure.) Harris gets a plum matchup against the Seahawks on Sunday night. Seattle has yielded 726 rushing yards, the second-highest total in the league behind only the Chargers. The Seahawks are giving up 24.5 fantasy points per game to running backs, the fourth-highest total in the league. Harris is a must-start as a mid-range RB1.",start,,RB4,A,18.9,4.040099999999999
16425,Kareem Hunt,0ef0d0ca-2d2d-455b-ab63-a20c01303e37,CLE,RB,RB,K. Hunt,RB,RB,https://www.fantasypros.com/nfl/players/kareem-hunt.php,kareem-hunt.php,https://images.fantasypros.com/images/players/nfl/16425/headshot/210x210.png,https://images.fantasypros.com/images/players/nfl/16425/headshot/210x210.png,30199,2079567,13,96.9,96.8,97,vs. ARI,ARI,4.0,5,1,13,5.22,2.90,"As fantasy's sixth-ranked RB through five weeks, Hunt has become a near must-start option every week. He's receiving fewer touches than Nick Chubb, but the touchdowns and receptions favor Hunt, making him a huge value.",start,,RB5,A,18.2,8.41
19217,Jonathan Taylor,925195a4-06ba-4e37-ae7d-a3d6a5419139,IND,RB,RB,J. Taylor,RB,RB,https://www.fantasypros.com/nfl/players/jonathan-taylor.php,jonathan-taylor.php,https://images.fantasypros.com/images/players/nfl/19217/headshot/210x210.png,https://images.fantasypros.com/images/players/nfl/19217/headshot/210x210.png,32711,2866395,14,99.8,99.5,100,vs. HOU,HOU,,6,3,10,6.56,1.82,"Taylor has the potential to go off this week in a home matchup against a Texans defense giving up 134.8 rushing yards per game, the seventh-highest total in the league. Houston has yielded nine TD runs. Taylor reminded us in Week 5 that he's also dangerous as a pass-catcher. He took a screen pass 76 yards for a touchdown just two minutes into the Colts' Monday-night game against the Ravens on the way to the first 100-yard receiving game of his career. Taylor is ranked RB4 this week. At $6,600 on DraftKings, he's one of the best RB values on the board.",start,,RB6,A,17.6,1.1041333333333334
16673,Aaron Jones,27dd5b6e-ea65-4622-a6b4-460fd144407c,GB,RB,RB,A. Jones,RB,RB,https://www.fantasypros.com/nfl/players/aaron-jones.php,aaron-jones.php,https://images.fantasypros.com/images/players/nfl/16673/headshot/210x210.png,https://images.fantasypros.com/images/players/nfl/16673/headshot/210x210.png,30295,2071937,13,99.9,99.8,100,at CHI,CHI,,7,4,10,7.00,1.74,"Since Week 2, Jones has averaged 20 touches a week and has logged no fewer than 18 touches in each of those games. He's been the RB5 in fantasy scoring over that span, and he's the RB7 on the season if we include the Packers' Week 1 debacle against the Saints, in which Jones had seven touches and 22 yards from scrimmage. It goes without saying that Jones is a weekly must-start, and at a DraftKings price of $7,300, he worth considering for cash games.",start,,RB7,A,17.2,0.7569
19210,D'Andre Swift,cc4b5f58-a11c-4450-a1df-617ad88336e4,DET,RB,RB,D. Swift,RB,RB,https://www.fantasypros.com/nfl/players/dandre-swift.php,dandre-swift.php,https://images.fantasypros.com/images/players/nfl/19210/headshot/210x210.png,https://images.fantasypros.com/images/players/nfl/19210/headshot/210x210.png,32705,2871710,9,98.6,98.2,99,vs. CIN,CIN,,8,5,10,7.22,1.37,"wift's snap share continues to climb, topping out at 74% last week in Minnesota. As good as he looked against the Vikings, he probably should have had more than 17 touches. Swift finished with 11-51-1 rushing and 6-53-0 receiving. For the season, Swift is averaging 10.4 carries a game and has drawn at least five targets in every game. Expect similar usage this week in a neutral matchup against the Bengals. Swift checks in at RB10 in the rankings and is a good DraftKings value at $6,300.",start,,RB8,A,17.0,0.37538000000000005
19631,James Robinson,5fc196a1-2015-49c7-85b2-1adbd2c33cf5,JAC,RB,RB,J. Robinson,RB,RB,https://www.fantasypros.com/nfl/players/james-robinson.php,james-robinson.php,https://images.fantasypros.com/images/players/nfl/19631/headshot/210x210.png,https://images.fantasypros.com/images/players/nfl/19631/headshot/210x210.png,33138,2257036,7,98.8,98.6,99,vs. MIA,MIA,,9,6,11,8.02,1.20,"J-Rob's usage had fantasy managers scrambling in Weeks 1-2, but he's averaged just shy of 20 touches per game across his last three while finishing as a top-9 option in every game. Expect big numbers against Miami in Sunday's London matchup.",start,,RB9,A,16.5,0.24
16374,Dalvin Cook,8960d61e-433b-41ea-a7ad-4e76be87b582,MIN,RB,RB,D. Cook,RB,RB,https://www.fantasypros.com/nfl/players/dalvin-cook.php,dalvin-cook.php,https://images.fantasypros.com/images/players/nfl/16374/headshot/210x210.png,https://images.fantasypros.com/images/players/nfl/16374/headshot/210x210.png,30154,2130893,7,100.0,99.9,100,at CAR,CAR,2.0,10,4,14,9.76,2.31,,,,RB10,A,16.1,1.334025
16420,Joe Mixon,7797f36e-87e8-4282-b6d2-bdb1774fc3b3,CIN,RB,RB,J. Mixon,RB,RB,https://www.fantasypros.com/nfl/players/joe-mixon.php,joe-mixon.php,https://images.fantasypros.com/images/players/nfl/16420/headshot/210x210.png,https://images.fantasypros.com/images/players/nfl/16420/headshot/210x210.png,30161,2131143,10,99.6,99.2,100,at DET,DET,2.0,11,8,15,11.61,1.38,"Despite two excellent matchups in his last two games, Mixon has finished outside the top-20 RBs in both instances. One of the biggest issues with his fantasy value this season? Lack of involvement as a receiver. Over his last four games, Mixon has four receptions. That's not going to cut it. Mixon deserves a top-12 ranking against Detroit's defense, though fantasy managers should be apprehensive.",start,,RB11,A-,15.6,0.23804999999999996
19624,Antonio Gibson,c0a8a5d0-583f-457a-9d96-70027d3f69e7,WAS,RB,RB,A. Gibson,RB,RB,https://www.fantasypros.com/nfl/players/antonio-gibson.php,antonio-gibson.php,https://images.fantasypros.com/images/players/nfl/19624/headshot/210x210.png,https://images.fantasypros.com/images/players/nfl/19624/headshot/210x210.png,32736,2960976,9,99.4,98.8,100,vs. KC,KC,-3.0,12,9,15,11.80,1.49,"Gibby's shin injury didn't seem to bother him in Week 5 as he totaled 22 touches and scored a pair of touchdowns to finish the week as the RB12. That injury shouldn't be a concern in Week 6 either, as he gets a mouth-watering matchup with Kansas City's putrid defense.",start,,RB12,A-,15.5,0.24667777777777777
18588,Darrell Henderson Jr.,380c4d9b-d4c8-456c-ba50-25519edde899,LAR,RB,RB,D. Henderson Jr.,RB,RB,https://www.fantasypros.com/nfl/players/darrell-henderson.php,darrell-henderson.php,https://images.fantasypros.com/images/players/nfl/18588/headshot/210x210.png,https://images.fantasypros.com/images/players/nfl/18588/headshot/210x210.png,31902,2240590,11,97.4,96.7,98,at NYG,NYG,-2.0,13,10,15,11.93,1.18,"Henderson is now in the conversation for a potential league-winner with the way that he is playing compared to where he was drafted. In the four games Henderson has played this season, he is averaging 15 rush attempts, 73.5 rushing yards, .75 rushing touchdowns, 2.5 receptions, and 22.5 receiving yards per game. He's become one of the most consistent fantasy assets at the RB position this season and the schedule now opens up for him and the Rams rushing attack. Henderson has been putting up these types of numbers against Chicago, Indianapolis, Arizona, and Seattle and those are not easy matchups on the ground. The next three weeks, Henderson gets to take on the New York Giants, the Detroit Lions, and the Houston Texans. In a matchup against the Giants that just allowed the Cowboys' RBs to rumble for 185 yards on the ground, Henderson's a smash play. He can now consistently be viewed as a low-end RB1 with upside every single week.",,,RB13,A-,15.5,0.13923999999999997
16378,Leonard Fournette,7f46a7be-286e-4bfe-8778-d03dbe600ce9,TB,RB,RB,L. Fournette,RB,RB,https://www.fantasypros.com/nfl/players/leonard-fournette.php,leonard-fournette.php,https://images.fantasypros.com/images/players/nfl/16378/headshot/210x210.png,https://images.fantasypros.com/images/players/nfl/16378/headshot/210x210.png,30117,2131693,9,93.6,93.1,94,at PHI,PHI,,14,13,23,15.95,1.81,"When Bernard was activated right before kickoff last week, I panicked and dropped Leonard Fournette a bit in my weekly rankings. He was definitely still worth starting, but I had plenty of concerns about what his workload would be with Gio in the fold. While Bernard was able to find the end zone as a receiver, it didn't make much of a difference for Fournette and he appears to now have locked away the starting role in this offense. Fournette had 17 total opportunities in week five against the Dolphins and he turned it into 110 total yards and a score. He is experiencing a career resurgence here in Tampa Bay and he's looking like the old Fournette that we saw at LSU that was worthy of the No. 4 overall pick in the 2017 NFL Draft. He's pulled away from Jones from a snap count perspective (46 snaps in week five to just 10 for Jones) and he still maintained a heavy workload through the air with Gio active. Moving forward, there's no reason why we shouldn't view Fournette as a mid-range RB2 every single week. He's in one of the league's top offenses and he's now secured this starting job. Against Philadelphia, who just allowed Chuba Hubbard to run for over 100 yards, Fournette's a rock-solid start as a mid-range RB2 with upside.",,,RB14,B+,15.3,0.2520076923076923
17514,Darrel Williams,c2a19a09-74a2-4ace-8cc3-6dfb65070a70,KC,RB,RB,D. Williams,RB,RB,https://www.fantasypros.com/nfl/players/darrel-williams.php,darrel-williams.php,https://images.fantasypros.com/images/players/nfl/17514/headshot/210x210.png,https://images.fantasypros.com/images/players/nfl/17514/headshot/210x210.png,31500,2131714,12,77.1,70.2,84,at WAS,WAS,,15,12,22,16.00,2.57,"As Kansas City's starting RB, Williams has RB2 upside even in a tough matchup with the Football Team. If you're looking for a high-upside flex, D-Will is your guy.",start,,RB15,B+,15.1,0.5504083333333333
18269,Josh Jacobs,61694ab9-b099-408e-b48d-6a643dd069ec,LV,RB,RB,J. Jacobs,RB,RB,https://www.fantasypros.com/nfl/players/josh-jacobs.php,josh-jacobs.php,https://images.fantasypros.com/images/players/nfl/18269/headshot/210x210.png,https://images.fantasypros.com/images/players/nfl/18269/headshot/210x210.png,31856,2257876,8,96.8,96.5,97,at DEN,DEN,,16,15,20,17.76,1.41,"Jacobs investors have to be pleased with his touch volume of late. In his first two games back from an ankle injury, Jacobs has had 28 carries and nine receptions. Those 37 touches have produced only 124 yards from scrimmage, but Jacobs did manage to punch in a 1-yard touchdown against the Bears in Week 5. The Raiders' opponents this week, the Broncos, are allowing 3.7 yards per carry. Denver's run defense ranks 10th in Football Outsiders' DVOA metric and is graded by PFF as the second-best in the league. Jacobs is a midrange RB2 this week based on volume, but he could be looking at another modest yardage total.",,,RB16,B,14.2,0.13254
22763,Khalil Herbert,02af99e0-3c84-4d4e-937a-a9f29a02323b,CHI,RB,RB,K. Herbert,RB,RB,https://www.fantasypros.com/nfl/players/khalil-herbert.php,khalil-herbert.php,https://images.fantasypros.com/images/players/nfl/22763/headshot/210x210.png,https://images.fantasypros.com/images/players/nfl/22763/headshot/210x210.png,33605,2253041,10,61.0,58.9,63,vs. GB,GB,4.0,17,14,35,18.56,4.11,,,,RB17,B,13.8,1.2065785714285717
19263,Zack Moss,d8fef424-aa41-4c26-9bce-1265b53cd5e2,BUF,RB,RB,Z. Moss,RB,RB,https://www.fantasypros.com/nfl/players/zack-moss.php,zack-moss.php,https://images.fantasypros.com/images/players/nfl/19263/headshot/210x210.png,https://images.fantasypros.com/images/players/nfl/19263/headshot/210x210.png,32756,2240516,7,84.5,80.9,88,at TEN,TEN,,18,16,24,19.12,2.51,"Moss has been a solid option for fantasy managers this season, though his value has been largely touchdown-dependent. There's no reason to fear, as his Week 6 opponent is tied for sixth-most rushing TDs allowed to opposing RBs on the year. FIre up Moss as a mid-range RB2 against the Titans.",start,,RB18,B,13.1,0.3937562499999999
19792,Chuba Hubbard,32205e74-b23f-420a-b312-465b29260745,CAR,RB,RB,C. Hubbard,RB,RB,https://www.fantasypros.com/nfl/players/chuba-hubbard.php,chuba-hubbard.php,https://images.fantasypros.com/images/players/nfl/19792/headshot/210x210.png,https://images.fantasypros.com/images/players/nfl/19792/headshot/210x210.png,33514,2865693,13,77.7,73.4,82,vs. MIN,MIN,14.0,19,13,42,19.24,7.33,"C-Mac has a chance to return this week, but if he's unable to go, Hubbard should be considered an RB2/flex. If McCaffrey is unable to go, Hubbard would get a significant boost in value.",,,RB19,B,13.1,4.132992307692308
17496,Chase Edmonds,d8d9b161-7ef4-42bf-89b7-7edf806a0ad1,ARI,RB,RB,C. Edmonds,RB,RB,https://www.fantasypros.com/nfl/players/chase-edmonds.php,chase-edmonds.php,https://images.fantasypros.com/images/players/nfl/17496/headshot/210x210.png,https://images.fantasypros.com/images/players/nfl/17496/headshot/210x210.png,31104,2137507,12,93.9,94.7,93,at CLE,CLE,,20,13,26,20.22,2.56,"Edmonds was banged up with a shoulder injury coming into last week's contest and he saw a reduced workload as a result. He finished with just 10 total opportunities and it only resulted in 34 total yards, but after being a week removed from the injury, Edmonds should see closer to his normal workload this week and he can be put back into the low-end RB2/high-end RB3 conversation.",,,RB20,B,12.4,0.5041230769230769
15555,Devontae Booker,cd705357-f282-4cbf-8f11-391618d981c3,NYG,RB,RB,D. Booker,RB,RB,https://www.fantasypros.com/nfl/players/devontae-booker.php,devontae-booker.php,https://images.fantasypros.com/images/players/nfl/15555/headshot/210x210.png,https://images.fantasypros.com/images/players/nfl/15555/headshot/210x210.png,29370,2061491,10,76.9,80.8,73,vs. LAR,LAR,,21,16,30,20.49,3.41,"With Saquon Barkley likely to miss the next couple of weeks with a left ankle sprain, Booker is going to assume the lead-back role in this offense. While Booker should see a minimum of 12 touches in this game, we shouldn't exactly be expecting the same level of production as Barkley. Booker has stepped in on occasion as the lead back throughout his time in the NFL and he's been able to be a fine fantasy asset in those performances, but the upside simply isn't there. In this offense that may not even have its starting QB on Sunday, we shouldn't be expecting much from Booker from a fantasy perspective. He can be viewed as a low-end RB2 simply based on volume.",sit,,RB21,B,11.4,0.7267562500000001
17251,Myles Gaskin,cad49098-1523-4e52-9f50-caa3423e1bb6,MIA,RB,RB,M. Gaskin,RB,RB,https://www.fantasypros.com/nfl/players/myles-gaskin.php,myles-gaskin.php,https://images.fantasypros.com/images/players/nfl/17251/headshot/210x210.png,https://images.fantasypros.com/images/players/nfl/17251/headshot/210x210.png,32066,2180360,14,90.2,90.3,90,at JAC,JAC,,22,15,26,21.05,2.70,"After doing next to nothing in Week 4, Gaskin finished as the RB4 in Week 5 thanks to a 10/74/2 receiving line. What will his workload be in Week 6? That's anyone's guess, but we should project him to see at least a normal workload in a favorable London matchup. Gaskin is a mid-range RB2 here.",start,,RB22,B,11.3,0.48600000000000004
22739,Javonte Williams,889dcdc5-3d88-45df-9677-5ad7ff87c011,DEN,RB,RB,J. Williams,RB,RB,https://www.fantasypros.com/nfl/players/javonte-williams.php,javonte-williams.php,https://images.fantasypros.com/images/players/nfl/22739/headshot/210x210.png,https://images.fantasypros.com/images/players/nfl/22739/headshot/210x210.png,33423,2961719,11,86.0,84.9,87,vs. LV,LV,,23,18,27,21.56,2.60,"The Raiders have had a tough week, with the Jon Gruden email scandal throwing the organization into turmoil. If the Raiders come into Denver flat this weekend, both of the Broncos' running backs could produce satisfying rushing numbers. Williams' carry totals this season have been dictated by game script. When Denver raced out to a 3-0 start, Williams was averaging 13 carries. Over the last two weeks, with Denver playing mostly from behind in losses to the Ravens and Steelers, Williams has averaged 7.5 carries. The rookie managed to make the most of his carries in Week 5, rushing eight times for 61 yards. He's had three receptions in three straight games. Gordon's volume has also waned in the last two weeks. He averaged 14 carries a game in the Broncos' three wins, nine carries in their two losses. Williams is ranked RB20 this week, Gordon RB21. I really like Williams at $5,000 on DraftKings, and Gordon has some GPP appeal at $5,100.",,,RB23,B-,11.2,0.3755555555555556
13903,Melvin Gordon III,0f8ccece-d663-4069-944b-f318f64c60b7,DEN,RB,RB,M. Gordon III,RB,RB,https://www.fantasypros.com/nfl/players/melvin-gordon.php,melvin-gordon.php,https://images.fantasypros.com/images/players/nfl/13903/headshot/210x210.png,https://images.fantasypros.com/images/players/nfl/13903/headshot/210x210.png,28403,1871347,11,86.8,84.6,89,vs. LV,LV,,24,20,27,24.00,1.36,"The Raiders have had a tough week, with the Jon Gruden email scandal throwing the organization into turmoil. If the Raiders come into Denver flat this weekend, both of the Broncos' running backs could produce satisfying rushing numbers. Williams' carry totals this season have been dictated by game script. When Denver raced out to a 3-0 start, Williams was averaging 13 carries. Over the last two weeks, with Denver playing mostly from behind in losses to the Ravens and Steelers, Williams has averaged 7.5 carries. The rookie managed to make the most of his carries in Week 5, rushing eight times for 61 yards. He's had three receptions in three straight games. Gordon's volume has also waned in the last two weeks. He averaged 14 carries a game in the Broncos' three wins, nine carries in their two losses. Williams is ranked RB20 this week, Gordon RB21. I really like Williams at $5,000 on DraftKings, and Gordon has some GPP appeal at $5,100.",,,RB24,B-,11.2,0.09248000000000002
18230,Damien Harris,59482736-ce42-4058-b68e-0f9f66eac2d9,NE,RB,RB,D. Harris,RB,RB,https://www.fantasypros.com/nfl/players/damien-harris-rb.php,damien-harris-rb.php,https://images.fantasypros.com/images/players/nfl/18230/headshot/210x210.png,https://images.fantasypros.com/images/players/nfl/18230/headshot/210x210.png,31919,2186318,14,84.8,78.6,91,vs. DAL,DAL,,25,18,36,25.88,4.23,"Harris was inches away last week from having two touchdowns. Instead, the play was reversed and Harris went from having six additional points to losing two due to a fumble right at the goal-line. Thankfully, he was able to come through for fantasy purposes and find the end zone in a plus matchup before leaving with an injury, which he is still reportedly dealing with this week. We'll need to monitor the practice reports this week for Harris, but if he does play, he's worth starting as a low-end RB2.",,,RB25,C+,11.1,0.9940500000000002
15546,Alex Collins,990a689e-200b-4cda-85db-85d6c3af911c,SEA,RB,RB,A. Collins,RB,RB,https://www.fantasypros.com/nfl/players/alex-collins.php,alex-collins.php,https://images.fantasypros.com/images/players/nfl/15546/headshot/210x210.png,https://images.fantasypros.com/images/players/nfl/15546/headshot/210x210.png,29405,2079843,9,46.3,38.6,54,at PIT,PIT,4.0,26,22,35,26.49,3.16,,,,RB26,C+,11.1,0.4538909090909092
16424,Jamaal Williams,122e131c-b08c-4b10-901d-481a20aeffb8,DET,RB,RB,J. Williams,RB,RB,https://www.fantasypros.com/nfl/players/jamaal-williams.php,jamaal-williams.php,https://images.fantasypros.com/images/players/nfl/16424/headshot/210x210.png,https://images.fantasypros.com/images/players/nfl/16424/headshot/210x210.png,30247,2001287,9,75.1,73.2,77,vs. CIN,CIN,,27,23,32,27.02,1.87,"Jamaal Williams has averaged 13 carries over Detroit's last three games, but his usage in the passing game has really tapered off. Williams caught 8 of 9 targets in the season opener and 3 of 3 targets in Week 2. Since then he's seen only four targets in three games. Now that he's mostly just a runner, Williams isn't an appealing play against a Bengals defense that PFF grades out as seventh-best against the run. He's ranked RB32.",,,RB27,C+,10.5,0.15203913043478262
18705,Tony Pollard,33b0227d-4c21-4e71-b4cd-be35f7db9123,DAL,RB,RB,T. Pollard,RB,RB,https://www.fantasypros.com/nfl/players/tony-pollard.php,tony-pollard.php,https://images.fantasypros.com/images/players/nfl/18705/headshot/210x210.png,https://images.fantasypros.com/images/players/nfl/18705/headshot/210x210.png,31960,2184011,7,72.2,66.4,78,at NE,NE,,28,22,33,27.39,2.22,"Here are Pollard's total touches each week so far this season: 7, 16, 12, 10, and 18. He certainly doesn't have the upside for fantasy that many other options do at the position who see more volume, but he's proving that he's an incredibly consistent option for fantasy lineups. As fantasy managers are scrambling to figure out their RB2 spot every single week, Pollard's actually one of the more reliable and steady options for that spot. He's playing in a high-powered offense, he has a guaranteed role, and we know he has the talent to make those touches count. To prove this point, Pollard leads all RBs in the NFL in Yards Per Carry with 6.4 (min. 50 rush attempts). Based on the way he's been playing recently, he has to be elevated into the weekly high-end RB3 conversation. In this matchup against New England, Pollard's certainly worth starting if you've got him on your roster and you're in need of help at the RB spot.",,,RB28,C+,9.7,0.22401818181818187
16230,J.D. McKissic,260e8f87-1d08-4c69-8e2b-afa825c1a68a,WAS,RB,RB,J.D. McKissic,RB,RB,https://www.fantasypros.com/nfl/players/jd-mckissic.php,jd-mckissic.php,https://images.fantasypros.com/images/players/nfl/16230/headshot/210x210.png,https://images.fantasypros.com/images/players/nfl/16230/headshot/210x210.png,29650,1886804,9,43.6,46.1,41,vs. KC,KC,,29,22,31,28.51,1.89,"McKissic's weekly fantasy finishes have been all over the place, but he gets a good chance to post some solid numbers in Week 6. Facing a Chiefs team looking to get back on track, the Football Team may be chasing points, which could lead to passing work for JDM. He's a fine flex option.",start,,RB29,C,9.6,0.1623681818181818
