player_id,player_name,sportsdata_id,player_team_id,player_position_id,player_positions,player_short_name,player_eligibility,player_yahoo_positions,player_page_url,player_filename,player_square_image_url,player_image_url,player_yahoo_id,cbs_player_id,player_bye_week,player_owned_avg,player_owned_espn,player_owned_yahoo,player_opponent,player_opponent_id,player_ecr_delta,rank_ecr,rank_min,rank_max,rank_ave,rank_std,note,tag,recommendation,pos_rank,start_sit_grade,r2p_pts,uncertainty
17298,Josh Allen,3069db07-aa43-4503-ab11-2ae5c0002721,BUF,QB,QB,J. Allen,QB,QB,https://www.fantasypros.com/nfl/players/josh-allen-qb.php,josh-allen-qb.php,https://images.fantasypros.com/images/players/nfl/17298/headshot/210x210.png,https://images.fantasypros.com/images/players/nfl/17298/headshot/210x210.png,30977,2181054,7,100.0,99.9,100,vs. IND,IND,1.0,1,1,2,1.19,0.39,"Not that there was ever much reason to worry about Allen, but he bounced back from a terrible game against the Jaguars in Week 9 to throw for a season-high 366 yards and two touchdowns against the Jets in Week 10. This week, he faces a Colts defense that's been easier to throw on than to run on. Opponents have connected for a league-high 23 TD passes against Indianapolis this season, and the Colts' pass defense ranks 23rd in DVOA. Allen leads all quarterbacks with 24.7 fantasy points per game. He's the QB2 this week behind only Lamar Jackson. Allen is obviously a must-start in season-long leagues, but he's a fade on DraftKings at an exorbitant price of $8,100.",,,QB1,A+,24.2,0.1521
16413,Patrick Mahomes II,11cad59d-90dd-449c-a839-dddaba4fe16c,KC,QB,QB,P. Mahomes II,QB,QB,https://www.fantasypros.com/nfl/players/patrick-mahomes.php,patrick-mahomes.php,https://images.fantasypros.com/images/players/nfl/16413/headshot/210x210.png,https://images.fantasypros.com/images/players/nfl/16413/headshot/210x210.png,30123,2142052,12,100.0,99.9,100,vs. DAL,DAL,,2,1,4,2.41,0.72,,,,QB2,A,23.9,0.5184
15600,Dak Prescott,86197778-8d4b-4eba-affe-08ef7be7c70b,DAL,QB,QB,D. Prescott,QB,QB,https://www.fantasypros.com/nfl/players/dak-prescott.php,dak-prescott.php,https://images.fantasypros.com/images/players/nfl/15600/headshot/210x210.png,https://images.fantasypros.com/images/players/nfl/15600/headshot/210x210.png,29369,1824864,7,98.7,98.3,99,at KC,KC,,3,2,6,3.54,0.98,,,,QB3,A,23.0,0.48019999999999996
9603,Tom Brady,41c44740-d0f6-44ab-8347-3b5d515e5ecf,TB,QB,QB,T. Brady,QB,QB,https://www.fantasypros.com/nfl/players/tom-brady.php,tom-brady.php,https://images.fantasypros.com/images/players/nfl/9603/headshot/210x210.png,https://images.fantasypros.com/images/players/nfl/9603/headshot/210x210.png,5228,187741,9,98.9,98.7,99,vs. NYG,NYG,,4,2,5,3.81,0.73,"Uh-oh. It's Tom Brady vs. the Giants. This is going to be a memorable game, isn't it? OK, so these aren't the Eli Manning-era Giants who proved to be such a perfect foil for Brady and the Patriots. But it will still be fun to watch Brady face a team against whom he has such a freighted history. Brady didn't play especially well last week in a 29-19 loss to Washington, throwing for 220 yards with two touchdowns and two interceptions. But he's thrown 17 TD passes in his last five games and is on pace for a 51-TD season. Brady is the QB4 this week.",,,QB4,A,22.3,0.26644999999999996
19275,Jalen Hurts,64bd0f02-6a5d-407e-98f1-fd02048ea21d,PHI,QB,QB,J. Hurts,QB,QB,https://www.fantasypros.com/nfl/players/jalen-hurts.php,jalen-hurts.php,https://images.fantasypros.com/images/players/nfl/19275/headshot/210x210.png,https://images.fantasypros.com/images/players/nfl/19275/headshot/210x210.png,32723,2240246,14,95.3,94.6,96,vs. NO,NO,,5,5,8,5.76,0.82,"Here's another example of the power of a running quarterback. Hurts has attempted 54 passes over the last three weeks - an average of just 18 throws per game - yet he finished QB6 and QB12 in two of those weeks. The one clunker was in Week 8, when he attempted just 14 passes in a 44-6 blowout of the Lions and had 103 passing yards and no touchdowns. Even with 71 rushing yards in that game, Hurts was the QB25 for the week - his first time finishing outside QB1 range all season. The Eagles have been extremely run-heavy of late, but they might not be able to play that way this week against New Orleans. The Saints are yielding a league-low 72.9 rushing yards per game and 3.1 yards per carry, so Hurts might have to take to the air. He checks in as the QB7 this week.",,,QB5,A-,21.6,0.13448
9001,Aaron Rodgers,0ce48193-e2fa-466e-a986-33f751add206,GB,QB,QB,A. Rodgers,QB,QB,https://www.fantasypros.com/nfl/players/aaron-rodgers.php,aaron-rodgers.php,https://images.fantasypros.com/images/players/nfl/9001/headshot/210x210.png,https://images.fantasypros.com/images/players/nfl/9001/headshot/210x210.png,7200,419780,13,97.2,96.4,98,at MIN,MIN,,6,5,10,6.76,0.97,"Rodgers wasn't especially sharp last week in his return from a one-week stay on the COVID-19 list, completing 23 of 37 passes for 292 yards with no touchdowns and one interception in a 17-0 win over Seattle. That game snapped a streak of seven straight games in which Rodgers had thrown multiple TD passes. A-Rod has a difficult matchup this week against a Vikings pass defense that ranks sixth in DVOA. Rodgers torched Minnesota for 655 passing yards and seven touchdowns in two games last season, but the Vikings' defense was decimated by injuries in 2020. It's been a much tougher unit this year, and it appears the Vikings may get CB Patrick Peterson back from a hamstring injury and S Harrison Smith back from the COVID-19 list this week. Rodgers is the QB8 this week.",,,QB6,B+,20.9,0.18818
18635,Justin Herbert,f0a8f8e3-b9e9-46ed-85e4-eec6452a8a44,LAC,QB,QB,J. Herbert,QB,QB,https://www.fantasypros.com/nfl/players/justin-herbert.php,justin-herbert.php,https://images.fantasypros.com/images/players/nfl/18635/headshot/210x210.png,https://images.fantasypros.com/images/players/nfl/18635/headshot/210x210.png,32676,2221960,7,97.8,96.6,99,vs. PIT,PIT,,7,5,9,7.30,1.27,"Herbert has been trending downward ever since pasting the Browns for 398 passing yards and four touchdowns in Week 5. His weekly fantasy finishes in the Chargers' four games since: QB22, QB15, QB2, QB15. That's hardly a disastrous run, and there's even a QB2 week mixed in there. But it's not the sort of excellence to which we've become accustomed with Herbert. He'll try to turn things around in Week 11 against a middling Steelers pass defense. He's a low-end QB1 this week, but he's a fade in DraftKings contests at $6,700.",start,,QB7,B+,20.4,0.32258
19196,Joe Burrow,3023ac10-4e7f-425f-9fc5-2b8e6332c92e,CIN,QB,QB,J. Burrow,QB,QB,https://www.fantasypros.com/nfl/players/joe-burrow.php,joe-burrow.php,https://images.fantasypros.com/images/players/nfl/19196/headshot/210x210.png,https://images.fantasypros.com/images/players/nfl/19196/headshot/210x210.png,32671,2179798,10,88.5,85.0,92,at LV,LV,,8,5,11,8.24,1.40,"The Raiders' defense was a tonic for Chiefs QB Patrick Mahomes, who had thrown only two TD passes over a three-game stretch before shredding the Las Vegas defense for 406 yards and five TDs in Week 10. Burrow could use a get-well game. He had thrown 20 TD passes in his first eight games before being held without a TD in the Bengals' 41-16 Week 9 loss to the Browns. With a Week 10 bye, Burrow has had extra time to stew on that performance. Consider him a low-end QB1 this week.",,,QB8,B,20.0,0.39199999999999996
11180,Russell Wilson,409d4cac-ee90-4470-9710-ebe671678339,SEA,QB,QB,R. Wilson,QB,QB,https://www.fantasypros.com/nfl/players/russell-wilson.php,russell-wilson.php,https://images.fantasypros.com/images/players/nfl/11180/headshot/210x210.png,https://images.fantasypros.com/images/players/nfl/11180/headshot/210x210.png,25785,1272242,9,93.5,91.0,96,vs. ARI,ARI,,9,8,12,10.14,1.04,,start,,QB9,B,19.6,0.13520000000000001
11174,Ryan Tannehill,5812204c-6dae-4450-8011-99e0f72864ac,TEN,QB,QB,R. Tannehill,QB,QB,https://www.fantasypros.com/nfl/players/ryan-tannehill.php,ryan-tannehill.php,https://images.fantasypros.com/images/players/nfl/11174/headshot/210x210.png,https://images.fantasypros.com/images/players/nfl/11174/headshot/210x210.png,25718,1273654,13,83.5,77.9,89,vs. HOU,HOU,,10,8,13,10.32,1.19,"A Week 11 matchup against Houston seems like a good setup for Tannehill. The Texans are allowing 20.8 fantasy points per game to quarterbacks, the fifth-highest total in the league, and opponents are averaging 8.1 yards per pass attempt against them. The concern is limited passing volume. Since Week 5, Tannehill has averaged 27.5 pass attempts per game and has thrown more than 30 passes in a game only once. Tannehill has been the QB17 in fantasy points per game over that span, and he'd rank even lower if not for four TD runs. Tannehill checks in at QB16 this week, and I have no interest in him at $6,700 on DraftKings.",sit,,QB10,B,19.2,0.1770125
12092,Derek Carr,9f026fc0-4449-4dc5-a226-2e2830619381,LV,QB,QB,D. Carr,QB,QB,https://www.fantasypros.com/nfl/players/derek-carr.php,derek-carr.php,https://images.fantasypros.com/images/players/nfl/12092/headshot/210x210.png,https://images.fantasypros.com/images/players/nfl/12092/headshot/210x210.png,27564,1664819,8,71.6,68.1,75,vs. CIN,CIN,,11,10,14,12.03,1.17,"Carr is averaging 314.0 yards a game, trailing only Tom Brady in that category. Although he doesn't run and hasn't thrown more than two TD passes in any game this season, he's still the QB13 in fantasy points per game. In Week 11, he'll face a slumping Bengals pass defense that let Baker Mayfield throw for 218 yards and two touchdowns on only 21 pass attempts in Week 9, and allowed Jets backup Mike White to throw for 405 yards and three TDs in Week 8. Carr is the QB12 this week.",start,,QB11,B-,18.9,0.13688999999999998
19198,Tua Tagovailoa,26ad9c27-de38-495e-913c-6fb2428e76d3,MIA,QB,QB,T. Tagovailoa,QB,QB,https://www.fantasypros.com/nfl/players/tua-tagovailoa.php,tua-tagovailoa.php,https://images.fantasypros.com/images/players/nfl/19198/headshot/210x210.png,https://images.fantasypros.com/images/players/nfl/19198/headshot/210x210.png,32675,2741209,14,40.2,47.3,33,at NYJ,NYJ,,12,9,19,13.32,1.90,,sit,,QB12,C+,18.6,0.4011111111111111
11177,Kirk Cousins,bbd0942c-6f77-4f83-a6d0-66ec6548019e,MIN,QB,QB,K. Cousins,QB,QB,https://www.fantasypros.com/nfl/players/kirk-cousins.php,kirk-cousins.php,https://images.fantasypros.com/images/players/nfl/11177/headshot/210x210.png,https://images.fantasypros.com/images/players/nfl/11177/headshot/210x210.png,25812,1272574,7,72.0,63.0,81,vs. GB,GB,,13,11,17,13.49,1.59,"After being held under 200 passing yards in two consecutive games, Cousins threw for 294 yards and two TDs last week in a road win over the Chargers. It was a convincing performance against one of the better pass defenses in the league. Cousins gets another tough matchup this week against a Green Bay pass defense that over its last three games has flummoxed Russell Wilson, Patrick Mahomes, and Kyler Murray, holding that formidable trio to 601 passing yards, 5.5 yards per pass attempt, one TD pass, and four interceptions. Cousins is a high-end QB2 this week and not an appealing DFS option.",start,,QB13,C+,18.4,0.22982727272727274
9869,Cam Newton,214e55e4-a089-412d-9598-a16495df0d25,CAR,QB,QB,C. Newton,QB,QB,https://www.fantasypros.com/nfl/players/cam-newton.php,cam-newton.php,https://images.fantasypros.com/images/players/nfl/9869/headshot/210x210.png,https://images.fantasypros.com/images/players/nfl/9869/headshot/210x210.png,24788,1273186,13,40.4,36.8,44,vs. WAS,WAS,,14,12,18,14.22,1.28,"""I'm back!"" There haven't been many better moments in the NFL this season than Newton scoring his first touchdown in Charlotte since 2018 and letting Panthers fans know it felt good to be back home. What can we expect from Cam the rest of the way? Even at the height of his powers, Newton was never one of the NFL's best pure passers. There were times last season with the Patriots when his arm simply didn't look NFL-caliber. Cam has dealt with multiple injuries to his throwing shoulder, so the condition of his arm is a wild card. We do know that he can still run. He looked spry in last week's win over the Cardinals and all of last season with the Patriots. It's probably best to regard Cam as a midrange QB2 the rest of the way and to be pleased if he performs better than that. He checks in at QB14 this week against a Washington defense that's giving up a league-high 26.4 fantasy points per game to quarterbacks.",start,,QB14,C,18.1,0.13653333333333334
19781,Justin Fields,cf15be8f-9117-4531-a517-2b9c7cb3e9e1,CHI,QB,QB,J. Fields,QB,QB,https://www.fantasypros.com/nfl/players/justin-fields.php,justin-fields.php,https://images.fantasypros.com/images/players/nfl/19781/headshot/210x210.png,https://images.fantasypros.com/images/players/nfl/19781/headshot/210x210.png,33399,1273205,10,25.3,20.5,30,vs. BAL,BAL,,15,14,20,16.41,1.70,"Fields went into the Bears' Week 10 bye on a roll, having finished QB5 in fantasy scoring in Week 8 and QB10 in Week 9 - his first two finishes in QB1 range all season. Fields had his two best rushing days of the season in his last two games, with 10-103-1 in Week 8 and 8-45-0 in Week 9. That's the key to his fantasy value, since Fields' passing numbers have been anemic, save for a 291-yard game in Week 9. The rookie has thrown just four TD passes in seven starts. Although things are trending up for Fields, he's still only a midrange QB2 this week against a middling Ravens pass defense.",sit,,QB15,C,17.9,0.2064285714285714
20156,Mac Jones,1fd00ec3-b758-46d2-a2c1-cca521ea8a54,NE,QB,QB,M. Jones,QB,QB,https://www.fantasypros.com/nfl/players/mac-jones.php,mac-jones.php,https://images.fantasypros.com/images/players/nfl/20156/headshot/210x210.png,https://images.fantasypros.com/images/players/nfl/20156/headshot/210x210.png,33403,2741202,14,31.7,22.4,41,at ATL,ATL,,16,13,19,16.68,1.12,"The fifth quarterback selected in this year's NFL Draft, Jones has been the best of the rookie QBs this season, and it's not that close. He played his most efficient game of the season last weekend, completing 19 of 23 passes for 198 yards with three touchdowns and no interceptions in the Patriots' 45-7 evisceration of the Browns. Since Week 4, Jones has averaged 7.9 yards per attempt. For what it's worth, Tom Brady has a career average of 7.5 yards per attempt. Just sayin'. Jones hasn't been a great fantasy quarterback this season, ranking 25th in fantasy points per game among QBs with at least six starts. That's largely because the Patriots' offense has the ninth-highest percentage of running plays, and because New England has scored 13 rushing touchdowns, the sixth-highest total in the league. But Jones has thrown multiple TD passes in three of his last five games. He gets a Week 11 date against an Atlanta pass defense that ranks 30th in DVOA and 31st in opponent passer rating. Jones is the QB15 this week and an attractive streaming option.",sit,,QB16,C,17.7,0.09649230769230771
12208,Jimmy Garoppolo,42de9d1d-0352-460b-9172-9452414fd7fd,SF,QB,QB,J. Garoppolo,QB,QB,https://www.fantasypros.com/nfl/players/jimmy-garoppolo.php,jimmy-garoppolo.php,https://images.fantasypros.com/images/players/nfl/12208/headshot/210x210.png,https://images.fantasypros.com/images/players/nfl/12208/headshot/210x210.png,27590,1760229,6,19.6,11.2,28,at JAC,JAC,,17,14,20,17.78,1.61,,,,QB17,C-,17.3,0.18515
18232,Daniel Jones,0042266b-cb28-4012-bfd2-06650badad97,NYG,QB,QB,D. Jones,QB,QB,https://www.fantasypros.com/nfl/players/daniel-jones.php,daniel-jones.php,https://images.fantasypros.com/images/players/nfl/18232/headshot/210x210.png,https://images.fantasypros.com/images/players/nfl/18232/headshot/210x210.png,31838,2179245,10,29.5,30.0,29,at TB,TB,,18,15,22,18.08,1.55,"""Um, excuse me. We were promised that Daniel Jones was going to be a Konami Code quarterback. I'd like to speak to the manager."" Jones has shown only incremental growth as a passer in his third NFL season, so the only way he's going to really pay dividends in fantasy is if he adds significant value with his rushing numbers. Early on, it looked like that might happen. Jones had 15-122-2 rushing in his first two games. He's had 35-136-0 rushing in his last seven contests. Since Week 3, Jones is QB25 in fantasy points per game among quarterbacks with at least four starts. He's the QB20 this week against the Buccaneers.",sit,,QB18,C-,17.0,0.16016666666666668
15520,Carson Wentz,e9a5c16b-4472-4be9-8030-3f77be7890cb,IND,QB,QB,C. Wentz,QB,QB,https://www.fantasypros.com/nfl/players/carson-wentz.php,carson-wentz.php,https://images.fantasypros.com/images/players/nfl/15520/headshot/210x210.png,https://images.fantasypros.com/images/players/nfl/15520/headshot/210x210.png,29236,1907522,14,52.5,49.0,56,at BUF,BUF,,19,15,25,19.73,2.49,"After throwing 14 TD passes over a six-game stretch, Wentz was held without a touchdown last week against the Jaguars. Now he has to travel to Buffalo to face a Bills defense that ranks No. 1 in both DVOA and opponent passer rating. Opponents have completed 57.9% of their passes against Buffalo, have averaged 5.7 yards per pass attempt, and have six TD passes and 15 interceptions. Wentz is the QB18 this week and unplayable in DFS.",sit,,QB19,D+,16.6,0.41334000000000004
13932,Taylor Heinicke,2c259733-ec2c-4e3c-bb7b-34dc0d37dc34,WAS,QB,QB,T. Heinicke,QB,QB,https://www.fantasypros.com/nfl/players/taylor-heinicke.php,taylor-heinicke.php,https://images.fantasypros.com/images/players/nfl/13932/headshot/210x210.png,https://images.fantasypros.com/images/players/nfl/13932/headshot/210x210.png,28839,2174914,9,13.7,13.3,14,at CAR,CAR,,20,19,28,21.70,2.10,"He's had his ups and downs in eight games as the Football Team's starting quarterback, but Heinicke is the QB13 in fantasy points per game since taking hold of the reins in Week 2. Heinicke wasn't especially crisp in October, with three TD passes and six interceptions from Week 5 to Week 8. But he was sharp in his first November game, a 29-19 win over the Buccaneers in which he completed 26 of 32 passes for 256 yards with one touchdown and no interceptions. Heinicke is merely a low-end QB2 this week in a difficult road matchup against the Panthers. Carolina's pass defense ranks second in DVOA and is allowing 6.4 yards per pass attempt.",,,QB20,D,16.2,0.23210526315789473
10007,Tyrod Taylor,7f3ef024-eb34-46af-8b9e-544cdf09378f,HOU,QB,QB,T. Taylor,QB,QB,https://www.fantasypros.com/nfl/players/tyrod-taylor.php,tyrod-taylor.php,https://images.fantasypros.com/images/players/nfl/10007/headshot/210x210.png,https://images.fantasypros.com/images/players/nfl/10007/headshot/210x210.png,24967,1243338,10,5.0,4.9,5,at TEN,TEN,,21,20,25,22.68,1.53,"It would be hard to make the case that Taylor is a good NFL quarterback, but he's been a good fantasy quarterback at times in his career, mostly because of his running ability. Taylor's passing limitations were on display in his Week 9 return from a hamstring injury. He completed 24 of 43 throws for 240 yards with no touchdowns and three interceptions, misfiring on a number of passes that really should have been completions. Taylor ran three times for 23 yards in that game. This week, Taylor faces a Titans defense that has given up 20.3 fantasy points per game to opposing quarterbacks. The thing is, the Titans haven't really allowed running quarterbacks to cut loose against them. Kyler Murray had 5-20-1 rushing against them in Week 1, and Josh Allen had 9-26-0 against them in Week 6. Taylor is a low-end QB2 this week.",,,QB21,D,15.8,0.117045
17237,Baker Mayfield,30198d30-9769-4e10-ac86-b4c91d940802,CLE,QB,QB,B. Mayfield,QB,QB,https://www.fantasypros.com/nfl/players/baker-mayfield.php,baker-mayfield.php,https://images.fantasypros.com/images/players/nfl/17237/headshot/210x210.png,https://images.fantasypros.com/images/players/nfl/17237/headshot/210x210.png,30971,2080032,13,33.2,30.4,36,vs. DET,DET,,22,19,27,22.86,2.09,"Mayfield is dealing with a knee injury but is expected to make the start this week against the Lions. Detroit's injury-plagued defense has been leaky against the pass, yielding a league-worst 8.5 yards per pass attempt. But Detroit also has a run-funnel defense, largely because the Lions constantly find themselves in negative game scripts. Opponents are running against the Lions on 50% of their offensive snaps, the second-highest rate in the league. With Mayfield not 100% healthy and Nick Chubb expected back after landing on the COVID-19 list for Week 10, there's a good chance the Browns will be extremely run-heavy this week. Mayfield lands at QB25 in this week's rankings despite the Lions' defensive issues.",,,QB22,D,15.5,0.22989999999999997
9444,Matt Ryan,7e648a0b-fdc8-4661-a587-5826f2cac11b,ATL,QB,QB,M. Ryan,QB,QB,https://www.fantasypros.com/nfl/players/matt-ryan.php,matt-ryan.php,https://images.fantasypros.com/images/players/nfl/9444/headshot/210x210.png,https://images.fantasypros.com/images/players/nfl/9444/headshot/210x210.png,8780,420095,6,48.0,43.9,52,vs. NE,NE,,23,19,26,23.30,1.49,"Ryan has been doing an admirable job under adverse circumstances this year, but the Falcons' offense ran aground last week in a 43-3 loss to the Cowboys. Ryan completed 9 of 21 passes against Dallas for 117 yards with no touchdowns and two interceptions. The veteran quarterback has been trying to make do with a bare-bones WR corps. Atlanta traded Julio Jones to Tennessee in June, and Calvin Ridley played five games before taking a mental-health sabbatical. In the first six games of the season, Ryan averaged 40.7 pass attempts and 278.0 passing yards per game, throwing 12 TD passes and four interceptions. In the three games since Ridley stepped away, Ryan has averaged 26.0 pass attempts and 202.0 yards per game, throwing three TD passes and four interceptions. Ryan now gets a tough Thursday-night draw against a Patriots defense that has more interceptions (14) than TD passes allowed (13) and is giving up 14.6 fantasy points per game to quarterbacks, the third-lowest total in the league. He's merely a back-end QB1 this week.",,,QB23,D-,15.3,0.11684736842105263
19780,Trevor Lawrence,aaa8b42c-4d87-45f6-bfd2-e31cfed9a736,JAC,QB,QB,T. Lawrence,QB,QB,https://www.fantasypros.com/nfl/players/trevor-lawrence.php,trevor-lawrence.php,https://images.fantasypros.com/images/players/nfl/19780/headshot/210x210.png,https://images.fantasypros.com/images/players/nfl/19780/headshot/210x210.png,33389,2967185,7,29.3,25.5,33,vs. SF,SF,,24,20,28,25.19,1.79,,,,QB24,F,15.1,0.160205
9039,Ben Roethlisberger,ea357add-1a41-4a8b-8f34-bbfade7f4d98,PIT,QB,QB,B. Roethlisberger,QB,QB,https://www.fantasypros.com/nfl/players/ben-roethlisberger.php,ben-roethlisberger.php,https://images.fantasypros.com/images/players/nfl/9039/headshot/210x210.png,https://images.fantasypros.com/images/players/nfl/9039/headshot/210x210.png,6770,493043,7,17.8,14.6,21,at LAC,LAC,4.0,25,20,32,25.67,2.67,,,,QB25,F,14.9,0.356445
14142,Trevor Siemian,e23dc743-ecee-4cf3-a263-69d3da3bae94,NO,QB,QB,T. Siemian,QB,QB,https://www.fantasypros.com/nfl/players/trevor-siemian.php,trevor-siemian.php,https://images.fantasypros.com/images/players/nfl/14142/headshot/210x210.png,https://images.fantasypros.com/images/players/nfl/14142/headshot/210x210.png,28638,2174210,6,4.8,4.5,5,at PHI,PHI,,26,21,29,26.92,1.46,"A career backup, Siemian has been surprisingly decent as a starter the last two weeks, completing 58.7% of his passes for 547 yards with four touchdowns and no interceptions. A solid performance against a bad Atlanta pass defense in Week 9 wasn't a shocker, but his 298-yard, two-TD performance against the Titans in Week 10 was noteworthy. Still, I'm not eager to bet on Siemian this week in a road game against the Eagles. He's the QB27 this week.",,,QB26,F,14.6,0.10150476190476189
9300,Joe Flacco,64797df2-efd3-4b27-86ee-1d48f7edb09f,NYJ,QB,QB,J. Flacco,QB,QB,https://www.fantasypros.com/nfl/players/joe-flacco.php,joe-flacco.php,https://images.fantasypros.com/images/players/nfl/9300/headshot/210x210.png,https://images.fantasypros.com/images/players/nfl/9300/headshot/210x210.png,8795,1250697,6,1.8,1.6,2,vs. MIA,MIA,,27,22,31,27.91,1.95,,,,QB27,F,14.4,0.17284090909090907
9702,Colt McCoy,3699dfd9-d437-43f7-b674-adbb31e7e64b,ARI,QB,QB,C. McCoy,QB,QB,https://www.fantasypros.com/nfl/players/colt-mccoy.php,colt-mccoy.php,https://images.fantasypros.com/images/players/nfl/9702/headshot/210x210.png,https://images.fantasypros.com/images/players/nfl/9702/headshot/210x210.png,24060,584648,12,1.6,1.2,2,at SEA,SEA,,28,24,36,28.71,2.93,,,,QB28,F,14.2,0.3577041666666667
17801,Tim Boyle,d897b70f-29d9-477e-a72a-c9bfbadb70d3,DET,QB,QB,T. Boyle,QB,QB,https://www.fantasypros.com/nfl/players/tim-boyle.php,tim-boyle.php,https://images.fantasypros.com/images/players/nfl/17801/headshot/210x210.png,https://images.fantasypros.com/images/players/nfl/17801/headshot/210x210.png,31431,2071997,9,0.6,0.2,1,at CLE,CLE,9.0,29,29,34,30.12,0.83,,,,QB29,F,13.7,0.023755172413793102
18600,Kyler Murray,dd5a6b6e-ffae-45a5-b8e6-718a9251f374,ARI,QB,QB,K. Murray,QB,QB,https://www.fantasypros.com/nfl/players/kyler-murray.php,kyler-murray.php,https://images.fantasypros.com/images/players/nfl/18600/headshot/210x210.png,https://images.fantasypros.com/images/players/nfl/18600/headshot/210x210.png,31833,2180829,12,99.9,99.7,100,at SEA,SEA,-8.0,30,8,34,19.79,10.29,,,,QB30,F,13.4,13.235512499999999
17115,Taysom Hill,3c8a55dd-20a8-4375-b711-49eb5e6e1d0e,NO,QB,QB,T. Hill,QB,QB,https://www.fantasypros.com/nfl/players/taysom-hill.php,taysom-hill.php,https://images.fantasypros.com/images/players/nfl/17115/headshot/210x210.png,https://images.fantasypros.com/images/players/nfl/17115/headshot/210x210.png,30614,2818935,6,3.8,2.6,5,at PHI,PHI,,31,30,35,31.38,1.00,,,,QB31,F,12.4,0.03333333333333333
